{
  "raw_response": "CORE:\n**Response:**\n\n```json\n{\n  \"overall_goal\": \"Master the fundamental concepts of convection heat and mass transfer, focusing on boundary layer theory, convection coefficients, flow regimes, governing equations, and dimensionless parameters.\",\n  \"total_study_day\": \"7\",\n  \"hour_per_day\": \"2.0\",\n  \"core_concepts\": [\n    {\n      \"name\": \"Boundary Layer Fundamentals\",\n      \"explanation\": \"Understanding the development of velocity, thermal, and concentration boundary layers in fluid flow.\",\n      \"importance\": \"Critical for analyzing heat and mass transfer in convective systems.\"\n    },\n    {\n      \"name\": \"Convection Coefficients\",\n      \"explanation\": \"Differentiating between local and average convection coefficients and their applications.\",\n      \"importance\": \"Essential for calculating heat and mass transfer rates.\"\n    },\n    {\n      \"name\": \"Flow Regimes\",\n      \"explanation\": \"Distinguishing between laminar and turbulent flow and their impact on transfer processes.\",\n      \"importance\": \"Determines the efficiency and behavior of convective systems.\"\n    },\n    {\n      \"name\": \"Governing Equations\",\n      \"explanation\": \"Deriving and applying simplified forms of momentum, energy, and species equations.\",\n      \"importance\": \"Forms the mathematical foundation for convective analysis.\"\n    },\n    {\n      \"name\": \"Dimensionless Parameters\",\n      \"explanation\": \"Understanding key parameters like Reynolds, Prandtl, and Schmidt numbers and their significance.\",\n      \"importance\": \"Enables scaling and comparison of different convective systems.\"\n    }\n  ],\n  \"general_tip\": [\n    \"Work through examples before looking at solutions to reinforce understanding.\",\n    \"Sketch boundary layer profiles to visualize different flow conditions.\",\n    \"Create comparison tables for key parameters like Prandtl numbers.\",\n    \"Apply heat transfer solutions to equivalent mass transfer problems for deeper learning.\",\n    \"Summarize key points at the end of each session to reinforce retention.\"\n  ]\n}\n```\n\nSCHEDULE:\n```json\n{\n  \"daily_schedule\": [\n    {\n      \"day\": 1,\n      \"date\": null,\n      \"focus_area\": \"Boundary Layer Fundamentals\",\n      \"study_item\": [\n        {\n          \"topic\": \"Boundary Layer Concepts\",\n          \"description\": \"Read and take notes on Section 6.1 (Boundary Layer Concepts)\",\n          \"duration_minutes\": 30,\n          \"resource\": [\n            {\n              \"title\": \"Section 6.1\",\n              \"type\": \"textbook\",\n              \"url\": null,\n              \"description\": \"Introduction to boundary layers\"\n            }\n          ],\n          \"is_completed\": false,\n          \"learning_objectives\": [\n            \"Understand the concept of boundary layers\",\n            \"Identify different types of boundary layers\"\n          ],\n          \"priority\": \"high\"\n        },\n        {\n          \"topic\": \"Velocity Boundary Layer\",\n          \"description\": \"Study velocity boundary layer development and thickness\",\n          \"duration_minutes\": 30,\n          \"resource\": [\n            {\n              \"title\": \"Section 6.1\",\n              \"type\": \"textbook\",\n              \"url\": null,\n              \"description\": \"Velocity boundary layer details\"\n            }\n          ],\n          \"is_completed\": false,\n          \"learning_objectives\": [\n            \"Understand velocity boundary layer development\",\n            \"Calculate boundary layer thickness\"\n          ],\n          \"priority\": \"high\"\n        },\n        {\n          \"topic\": \"Thermal and Concentration Boundary Layers\",\n          \"description\": \"Examine thermal and concentration boundary layers\",\n          \"duration_minutes\": 30,\n          \"resource\": [\n            {\n              \"title\": \"Section 6.1\",\n              \"type\": \"textbook\",\n              \"url\": null,\n              \"description\": \"Thermal and concentration boundary layers\"\n            }\n          ],\n          \"is_completed\": false,\n          \"learning_objectives\": [\n            \"Differentiate between thermal and concentration boundary layers\",\n            \"Understand their significance in heat and mass transfer\"\n          ],\n          \"priority\": \"medium\"\n        }\n      ],\n      \"summary\": \"Gained understanding of boundary layer fundamentals including velocity, thermal, and concentration boundary layers.\",\n      \"learning_goals\": [\n        \"Master boundary layer concepts\",\n        \"Understand boundary layer thickness calculations\"\n      ],\n      \"review_topics\": []\n    },\n    {\n      \"day\": 2,\n      \"date\": null,\n      \"focus_area\": \"Convection Coefficients\",\n      \"study_item\": [\n        {\n          \"topic\": \"Local and Average Coefficients\",\n          \"description\": \"Study Section 6.2 (Local and Average Coefficients)\",\n          \"duration_minutes\": 45,\n          \"resource\": [\n            {\n              \"title\": \"Section 6.2\",\n              \"type\": \"textbook\",\n              \"url\": null,\n              \"description\": \"Convection coefficients\"\n            }\n          ],\n          \"is_completed\": false,\n          \"learning_objectives\": [\n            \"Differentiate between local and average coefficients\",\n            \"Understand their applications\"\n          ],\n          \"priority\": \"high\"\n        },\n        {\n          \"topic\": \"Mass Transfer Application\",\n          \"description\": \"Analyze Example 6.2 (mass transfer application)\",\n          \"duration_minutes\": 45,\n          \"resource\": [\n            {\n              \"title\": \"Example 6.2\",\n              \"type\": \"textbook\",\n              \"url\": null,\n              \"description\": \"Mass transfer application example\"\n            }\n          ],\n          \"is_completed\": false,\n          \"learning_objectives\": [\n            \"Apply convection coefficients to mass transfer problems\",\n            \"Solve practical problems using coefficients\"\n          ],\n          \"priority\": \"high\"\n        }\n      ],\n      \"summary\": \"Learned about local and average convection coefficients and their applications in mass transfer.\",\n      \"learning_goals\": [\n        \"Understand convection coefficients\",\n        \"Apply coefficients to practical problems\"\n      ],\n      \"review_topics\": [\n        \"Boundary Layer Fundamentals\"\n      ]\n    },\n    {\n      \"day\": 3,\n      \"date\": null,\n      \"focus_area\": \"Flow Regimes\",\n      \"study_item\": [\n        {\n          \"topic\": \"Laminar vs. Turbulent Flow\",\n          \"description\": \"Study Section 6.3 (Laminar vs. Turbulent Flow)\",\n          \"duration_minutes\": 45,\n          \"resource\": [\n            {\n              \"title\": \"Section 6.3\",\n              \"type\": \"textbook\",\n              \"url\": null,\n              \"description\": \"Flow regimes\"\n            }\n          ],\n          \"is_completed\": false,\n          \"learning_objectives\": [\n            \"Differentiate between laminar and turbulent flow\",\n            \"Understand flow characteristics\"\n          ],\n          \"priority\": \"high\"\n        },\n        {\n          \"topic\": \"Transition Criteria\",\n          \"description\": \"Examine transition criteria and critical Reynolds numbers\",\n          \"duration_minutes\": 30,\n          \"resource\": [\n            {\n              \"title\": \"Section 6.3\",\n              \"type\": \"textbook\",\n              \"url\": null,\n              \"description\": \"Transition criteria\"\n            }\n          ],\n          \"is_completed\": false,\n          \"learning_objectives\": [\n            \"Understand transition criteria\",\n            \"Calculate critical Reynolds numbers\"\n          ],\n          \"priority\": \"medium\"\n        }\n      ],\n      \"summary\": \"Studied laminar and turbulent flow characteristics and transition criteria.\",\n      \"learning_goals\": [\n        \"Differentiate flow regimes\",\n        \"Understand transition criteria\"\n      ],\n      \"review_topics\": [\n        \"Convection Coefficients\"\n      ]\n    },\n    {\n      \"day\": 4,\n      \"date\": null,\n      \"focus_area\": \"Boundary Layer Equations\",\n      \"study_item\": [\n        {\n          \"topic\": \"Governing Equations\",\n          \"description\": \"Study Section 6.4 (Governing Equations)\",\n          \"duration_minutes\": 60,\n          \"resource\": [\n            {\n              \"title\": \"Section 6.4\",\n              \"type\": \"textbook\",\n              \"url\": null,\n              \"description\": \"Governing equations\"\n            }\n          ],\n          \"is_completed\": false,\n          \"learning_objectives\": [\n            \"Understand governing equations for boundary layers\",\n            \"Identify key terms in equations\"\n          ],\n          \"priority\": \"high\"\n        },\n        {\n          \"topic\": \"Simplified Equations\",\n          \"description\": \"Derive simplified forms of momentum, energy, and species equations\",\n          \"duration_minutes\": 30,\n          \"resource\": [\n            {\n              \"title\": \"Section 6.4\",\n              \"type\": \"textbook\",\n              \"url\": null,\n              \"description\": \"Simplified equations\"\n            }\n          ],\n          \"is_completed\": false,\n          \"learning_objectives\": [\n            \"Derive simplified equations\",\n            \"Understand their applications\"\n          ],\n          \"priority\": \"medium\"\n        }\n      ],\n      \"summary\": \"Learned about governing equations for boundary layers and their simplified forms.\",\n      \"learning_goals\": [\n        \"Understand boundary layer equations\",\n        \"Derive simplified forms\"\n      ],\n      \"review_topics\": [\n        \"Flow Regimes\"\n      ]\n    },\n    {\n      \"day\": 5,\n      \"date\": null,\n      \"focus_area\": \"Dimensionless Parameters\",\n      \"study_item\": [\n        {\n          \"topic\": \"Normalized Equations\",\n          \"description\": \"Study Section 6.5 (Normalized Equations)\",\n          \"duration_minutes\": 45,\n          \"resource\": [\n            {\n              \"title\": \"Section 6.5\",\n              \"type\": \"textbook\",\n              \"url\": null,\n              \"description\": \"Normalized equations\"\n            }\n          ],\n          \"is_completed\": false,\n          \"learning_objectives\": [\n            \"Understand normalization of equations\",\n            \"Identify key dimensionless parameters\"\n          ],\n          \"priority\": \"high\"\n        },\n        {\n          \"topic\": \"Dimensionless Parameters\",\n          \"description\": \"Learn about Re, Pr, Sc and their physical significance\",\n          \"duration_minutes\": 30,\n          \"resource\": [\n            {\n              \"title\": \"Section 6.5\",\n              \"type\": \"textbook\",\n              \"url\": null,\n              \"description\": \"Dimensionless parameters\"\n            }\n          ],\n          \"is_completed\": false,\n          \"learning_objectives\": [\n            \"Understand Reynolds, Prandtl, and Schmidt numbers\",\n            \"Apply dimensionless parameters\"\n          ],\n          \"priority\": \"high\"\n        }\n      ],\n      \"summary\": \"Studied normalized equations and key dimensionless parameters in convection.\",\n      \"learning_goals\": [\n        \"Understand dimensionless parameters\",\n        \"Apply normalization techniques\"\n      ],\n      \"review_topics\": [\n        \"Boundary Layer Equations\"\n      ]\n    },\n    {\n      \"day\": 6,\n      \"date\": null,\n      \"focus_area\": \"Analogies\",\n      \"study_item\": [\n        {\n          \"topic\": \"Heat and Mass Transfer Analogies\",\n          \"description\": \"Study Section 6.7 (Heat and Mass Transfer Analogies)\",\n          \"duration_minutes\": 45,\n          \"resource\": [\n            {\n              \"title\": \"Section 6.7\",\n              \"type\": \"textbook\",\n              \"url\": null,\n              \"description\": \"Heat and mass transfer analogies\"\n            }\n          ],\n          \"is_completed\": false,\n          \"learning_objectives\": [\n            \"Understand analogies between heat and mass transfer\",\n            \"Apply analogies to solve problems\"\n          ],\n          \"priority\": \"high\"\n        },\n        {\n          \"topic\": \"Reynolds Analogy\",\n          \"description\": \"Examine the Reynolds analogy and its modifications\",\n          \"duration_minutes\": 30,\n          \"resource\": [\n            {\n              \"title\": \"Section 6.7\",\n              \"type\": \"textbook\",\n              \"url\": null,\n              \"description\": \"Reynolds analogy\"\n            }\n          ],\n          \"is_completed\": false,\n          \"learning_objectives\": [\n            \"Understand Reynolds analogy\",\n            \"Apply modified forms\"\n          ],\n          \"priority\": \"medium\"\n        }\n      ],\n      \"summary\": \"Learned about heat and mass transfer analogies including the Reynolds analogy.\",\n      \"learning_goals\": [\n        \"Understand transfer analogies\",\n        \"Apply Reynolds analogy\"\n      ],\n      \"review_topics\": [\n        \"Dimensionless Parameters\"\n      ]\n    },\n    {\n      \"day\": 7,\n      \"date\": null,\n      \"focus_area\": \"Review and Application\",\n      \"study_item\": [\n        {\n          \"topic\": \"Key Concepts Review\",\n          \"description\": \"Review all key concepts and equations\",\n          \"duration_minutes\": 45,\n          \"resource\": [\n            {\n              \"title\": \"Chapter 6 Summary\",\n              \"type\": \"textbook\",\n              \"url\": null,\n              \"description\": \"Key concepts summary\"\n            }\n          ],\n          \"is_completed\": false,\n          \"learning_objectives\": [\n            \"Consolidate understanding of key concepts\",\n            \"Review important equations\"\n          ],\n          \"priority\": \"high\"\n        },\n        {\n          \"topic\": \"Practice Problems\",\n          \"description\": \"Work through additional practice problems\",\n          \"duration_minutes\": 30,\n          \"resource\": [\n            {\n              \"title\": \"Practice Problems\",\n              \"type\": \"textbook\",\n              \"url\": null,\n              \"description\": \"Additional problems\"\n            }\n          ],\n          \"is_completed\": false,\n          \"learning_objectives\": [\n            \"Apply concepts to solve problems\",\n            \"Identify areas needing improvement\"\n          ],\n          \"priority\": \"high\"\n        }\n      ],\n      \"summary\": \"Reviewed all key concepts and practiced applying them to problems.\",\n      \"learning_goals\": [\n        \"Consolidate understanding\",\n        \"Apply knowledge to problems\"\n      ],\n      \"review_topics\": [\n        \"All previous topics\"\n      ]\n    }\n  ]\n}\n```\n\nFORMULAS:\n```json\n{\n  \"key_formulas\": [\n    {\n      \"name\": \"Reynolds Number\",\n      \"formula\": \"Re = (\u03c1 * u * L)/\u03bc\",\n      \"description\": \"Dimensionless number that characterizes flow regimes (laminar vs. turbulent)\",\n      \"usage_context\": \"Used to determine flow characteristics in convection problems, typically with Re_crit \u2248 5\u00d710^5 for flat plate transition\"\n    },\n    {\n      \"name\": \"Prandtl Number\",\n      \"formula\": \"Pr = \u03bd/\u03b1 = (\u03bc * c_p)/k\",\n      \"description\": \"Ratio of momentum diffusivity to thermal diffusivity\",\n      \"usage_context\": \"Important for determining relative thickness of velocity and thermal boundary layers in heat transfer problems\"\n    },\n    {\n      \"name\": \"Schmidt Number\",\n      \"Sc\": \"Sc = \u03bd/D = \u03bc/(\u03c1 * D_AB)\",\n      \"description\": \"Ratio of momentum diffusivity to mass diffusivity\",\n      \"usage_context\": \"Used in mass transfer problems to relate velocity and concentration boundary layers\"\n    },\n    {\n      \"name\": \"Nusselt Number\",\n      \"formula\": \"Nu = (h * L)/k\",\n      \"description\": \"Dimensionless heat transfer coefficient\",\n      \"usage_context\": \"Relates convective to conductive heat transfer at a boundary, used to calculate heat transfer rates\"\n    },\n    {\n      \"name\": \"Sherwood Number\",\n      \"formula\": \"Sh = (h_m * L)/D_AB\",\n      \"description\": \"Dimensionless mass transfer coefficient\",\n      \"usage_context\": \"Mass transfer equivalent of Nusselt number, used to calculate mass transfer rates\"\n    },\n    {\n      \"name\": \"Skin Friction Coefficient\",\n      \"formula\": \"C_f = \u03c4_w/(0.5 * \u03c1 * u_\u221e^2)\",\n      \"description\": \"Dimensionless wall shear stress\",\n      \"usage_context\": \"Used to quantify drag force due to viscous effects in boundary layers\"\n    },\n    {\n      \"name\": \"Reynolds Analogy\",\n      \"formula\": \"St = C_f/2\",\n      \"description\": \"Relates momentum transfer to heat transfer\",\n      \"usage_context\": \"Used when Pr \u2248 1 to estimate heat transfer coefficients from known friction coefficients\"\n    }\n  ]\n}\n```",
  "error": {
    "error": "Failed to validate structured plan",
    "details": "1 validation error for StructuredStudyPlan\nkey_formulas.2.formula\n  Field required [type=missing, input_value={'name': 'Schmidt Number'...ration boundary layers'}, input_type=dict]\n    For further information visit https://errors.pydantic.dev/2.11/v/missing",
    "parsed_json": {
      "overall_goal": "Master the fundamental concepts of convection heat and mass transfer, focusing on boundary layer theory, convection coefficients, flow regimes, governing equations, and dimensionless parameters.",
      "total_study_day": "7",
      "hour_per_day": 2.0,
      "core_concepts": [
        {
          "name": "Boundary Layer Fundamentals",
          "explanation": "Understanding the development of velocity, thermal, and concentration boundary layers in fluid flow.",
          "importance": "Critical for analyzing heat and mass transfer in convective systems."
        },
        {
          "name": "Convection Coefficients",
          "explanation": "Differentiating between local and average convection coefficients and their applications.",
          "importance": "Essential for calculating heat and mass transfer rates."
        },
        {
          "name": "Flow Regimes",
          "explanation": "Distinguishing between laminar and turbulent flow and their impact on transfer processes.",
          "importance": "Determines the efficiency and behavior of convective systems."
        },
        {
          "name": "Governing Equations",
          "explanation": "Deriving and applying simplified forms of momentum, energy, and species equations.",
          "importance": "Forms the mathematical foundation for convective analysis."
        },
        {
          "name": "Dimensionless Parameters",
          "explanation": "Understanding key parameters like Reynolds, Prandtl, and Schmidt numbers and their significance.",
          "importance": "Enables scaling and comparison of different convective systems."
        }
      ],
      "general_tip": [
        "Work through examples before looking at solutions to reinforce understanding.",
        "Sketch boundary layer profiles to visualize different flow conditions.",
        "Create comparison tables for key parameters like Prandtl numbers.",
        "Apply heat transfer solutions to equivalent mass transfer problems for deeper learning.",
        "Summarize key points at the end of each session to reinforce retention."
      ],
      "daily_schedule": [
        {
          "day": 1,
          "date": null,
          "focus_area": "Boundary Layer Fundamentals",
          "study_item": [
            {
              "topic": "Boundary Layer Concepts",
              "description": "Read and take notes on Section 6.1 (Boundary Layer Concepts)",
              "duration_minutes": 30,
              "resource": [
                {
                  "title": "Section 6.1",
                  "type": "textbook",
                  "url": null,
                  "description": "Introduction to boundary layers"
                }
              ],
              "is_completed": false,
              "learning_objectives": [
                "Understand the concept of boundary layers",
                "Identify different types of boundary layers"
              ],
              "priority": "high"
            },
            {
              "topic": "Velocity Boundary Layer",
              "description": "Study velocity boundary layer development and thickness",
              "duration_minutes": 30,
              "resource": [
                {
                  "title": "Section 6.1",
                  "type": "textbook",
                  "url": null,
                  "description": "Velocity boundary layer details"
                }
              ],
              "is_completed": false,
              "learning_objectives": [
                "Understand velocity boundary layer development",
                "Calculate boundary layer thickness"
              ],
              "priority": "high"
            },
            {
              "topic": "Thermal and Concentration Boundary Layers",
              "description": "Examine thermal and concentration boundary layers",
              "duration_minutes": 30,
              "resource": [
                {
                  "title": "Section 6.1",
                  "type": "textbook",
                  "url": null,
                  "description": "Thermal and concentration boundary layers"
                }
              ],
              "is_completed": false,
              "learning_objectives": [
                "Differentiate between thermal and concentration boundary layers",
                "Understand their significance in heat and mass transfer"
              ],
              "priority": "medium"
            }
          ],
          "summary": "Gained understanding of boundary layer fundamentals including velocity, thermal, and concentration boundary layers.",
          "learning_goals": [
            "Master boundary layer concepts",
            "Understand boundary layer thickness calculations"
          ],
          "review_topics": []
        },
        {
          "day": 2,
          "date": null,
          "focus_area": "Convection Coefficients",
          "study_item": [
            {
              "topic": "Local and Average Coefficients",
              "description": "Study Section 6.2 (Local and Average Coefficients)",
              "duration_minutes": 45,
              "resource": [
                {
                  "title": "Section 6.2",
                  "type": "textbook",
                  "url": null,
                  "description": "Convection coefficients"
                }
              ],
              "is_completed": false,
              "learning_objectives": [
                "Differentiate between local and average coefficients",
                "Understand their applications"
              ],
              "priority": "high"
            },
            {
              "topic": "Mass Transfer Application",
              "description": "Analyze Example 6.2 (mass transfer application)",
              "duration_minutes": 45,
              "resource": [
                {
                  "title": "Example 6.2",
                  "type": "textbook",
                  "url": null,
                  "description": "Mass transfer application example"
                }
              ],
              "is_completed": false,
              "learning_objectives": [
                "Apply convection coefficients to mass transfer problems",
                "Solve practical problems using coefficients"
              ],
              "priority": "high"
            }
          ],
          "summary": "Learned about local and average convection coefficients and their applications in mass transfer.",
          "learning_goals": [
            "Understand convection coefficients",
            "Apply coefficients to practical problems"
          ],
          "review_topics": [
            "Boundary Layer Fundamentals"
          ]
        },
        {
          "day": 3,
          "date": null,
          "focus_area": "Flow Regimes",
          "study_item": [
            {
              "topic": "Laminar vs. Turbulent Flow",
              "description": "Study Section 6.3 (Laminar vs. Turbulent Flow)",
              "duration_minutes": 45,
              "resource": [
                {
                  "title": "Section 6.3",
                  "type": "textbook",
                  "url": null,
                  "description": "Flow regimes"
                }
              ],
              "is_completed": false,
              "learning_objectives": [
                "Differentiate between laminar and turbulent flow",
                "Understand flow characteristics"
              ],
              "priority": "high"
            },
            {
              "topic": "Transition Criteria",
              "description": "Examine transition criteria and critical Reynolds numbers",
              "duration_minutes": 30,
              "resource": [
                {
                  "title": "Section 6.3",
                  "type": "textbook",
                  "url": null,
                  "description": "Transition criteria"
                }
              ],
              "is_completed": false,
              "learning_objectives": [
                "Understand transition criteria",
                "Calculate critical Reynolds numbers"
              ],
              "priority": "medium"
            }
          ],
          "summary": "Studied laminar and turbulent flow characteristics and transition criteria.",
          "learning_goals": [
            "Differentiate flow regimes",
            "Understand transition criteria"
          ],
          "review_topics": [
            "Convection Coefficients"
          ]
        },
        {
          "day": 4,
          "date": null,
          "focus_area": "Boundary Layer Equations",
          "study_item": [
            {
              "topic": "Governing Equations",
              "description": "Study Section 6.4 (Governing Equations)",
              "duration_minutes": 60,
              "resource": [
                {
                  "title": "Section 6.4",
                  "type": "textbook",
                  "url": null,
                  "description": "Governing equations"
                }
              ],
              "is_completed": false,
              "learning_objectives": [
                "Understand governing equations for boundary layers",
                "Identify key terms in equations"
              ],
              "priority": "high"
            },
            {
              "topic": "Simplified Equations",
              "description": "Derive simplified forms of momentum, energy, and species equations",
              "duration_minutes": 30,
              "resource": [
                {
                  "title": "Section 6.4",
                  "type": "textbook",
                  "url": null,
                  "description": "Simplified equations"
                }
              ],
              "is_completed": false,
              "learning_objectives": [
                "Derive simplified equations",
                "Understand their applications"
              ],
              "priority": "medium"
            }
          ],
          "summary": "Learned about governing equations for boundary layers and their simplified forms.",
          "learning_goals": [
            "Understand boundary layer equations",
            "Derive simplified forms"
          ],
          "review_topics": [
            "Flow Regimes"
          ]
        },
        {
          "day": 5,
          "date": null,
          "focus_area": "Dimensionless Parameters",
          "study_item": [
            {
              "topic": "Normalized Equations",
              "description": "Study Section 6.5 (Normalized Equations)",
              "duration_minutes": 45,
              "resource": [
                {
                  "title": "Section 6.5",
                  "type": "textbook",
                  "url": null,
                  "description": "Normalized equations"
                }
              ],
              "is_completed": false,
              "learning_objectives": [
                "Understand normalization of equations",
                "Identify key dimensionless parameters"
              ],
              "priority": "high"
            },
            {
              "topic": "Dimensionless Parameters",
              "description": "Learn about Re, Pr, Sc and their physical significance",
              "duration_minutes": 30,
              "resource": [
                {
                  "title": "Section 6.5",
                  "type": "textbook",
                  "url": null,
                  "description": "Dimensionless parameters"
                }
              ],
              "is_completed": false,
              "learning_objectives": [
                "Understand Reynolds, Prandtl, and Schmidt numbers",
                "Apply dimensionless parameters"
              ],
              "priority": "high"
            }
          ],
          "summary": "Studied normalized equations and key dimensionless parameters in convection.",
          "learning_goals": [
            "Understand dimensionless parameters",
            "Apply normalization techniques"
          ],
          "review_topics": [
            "Boundary Layer Equations"
          ]
        },
        {
          "day": 6,
          "date": null,
          "focus_area": "Analogies",
          "study_item": [
            {
              "topic": "Heat and Mass Transfer Analogies",
              "description": "Study Section 6.7 (Heat and Mass Transfer Analogies)",
              "duration_minutes": 45,
              "resource": [
                {
                  "title": "Section 6.7",
                  "type": "textbook",
                  "url": null,
                  "description": "Heat and mass transfer analogies"
                }
              ],
              "is_completed": false,
              "learning_objectives": [
                "Understand analogies between heat and mass transfer",
                "Apply analogies to solve problems"
              ],
              "priority": "high"
            },
            {
              "topic": "Reynolds Analogy",
              "description": "Examine the Reynolds analogy and its modifications",
              "duration_minutes": 30,
              "resource": [
                {
                  "title": "Section 6.7",
                  "type": "textbook",
                  "url": null,
                  "description": "Reynolds analogy"
                }
              ],
              "is_completed": false,
              "learning_objectives": [
                "Understand Reynolds analogy",
                "Apply modified forms"
              ],
              "priority": "medium"
            }
          ],
          "summary": "Learned about heat and mass transfer analogies including the Reynolds analogy.",
          "learning_goals": [
            "Understand transfer analogies",
            "Apply Reynolds analogy"
          ],
          "review_topics": [
            "Dimensionless Parameters"
          ]
        },
        {
          "day": 7,
          "date": null,
          "focus_area": "Review and Application",
          "study_item": [
            {
              "topic": "Key Concepts Review",
              "description": "Review all key concepts and equations",
              "duration_minutes": 45,
              "resource": [
                {
                  "title": "Chapter 6 Summary",
                  "type": "textbook",
                  "url": null,
                  "description": "Key concepts summary"
                }
              ],
              "is_completed": false,
              "learning_objectives": [
                "Consolidate understanding of key concepts",
                "Review important equations"
              ],
              "priority": "high"
            },
            {
              "topic": "Practice Problems",
              "description": "Work through additional practice problems",
              "duration_minutes": 30,
              "resource": [
                {
                  "title": "Practice Problems",
                  "type": "textbook",
                  "url": null,
                  "description": "Additional problems"
                }
              ],
              "is_completed": false,
              "learning_objectives": [
                "Apply concepts to solve problems",
                "Identify areas needing improvement"
              ],
              "priority": "high"
            }
          ],
          "summary": "Reviewed all key concepts and practiced applying them to problems.",
          "learning_goals": [
            "Consolidate understanding",
            "Apply knowledge to problems"
          ],
          "review_topics": [
            "All previous topics"
          ]
        }
      ],
      "key_formulas": [
        {
          "name": "Reynolds Number",
          "formula": "Re = (\u03c1 * u * L)/\u03bc",
          "description": "Dimensionless number that characterizes flow regimes (laminar vs. turbulent)",
          "usage_context": "Used to determine flow characteristics in convection problems, typically with Re_crit \u2248 5\u00d710^5 for flat plate transition"
        },
        {
          "name": "Prandtl Number",
          "formula": "Pr = \u03bd/\u03b1 = (\u03bc * c_p)/k",
          "description": "Ratio of momentum diffusivity to thermal diffusivity",
          "usage_context": "Important for determining relative thickness of velocity and thermal boundary layers in heat transfer problems"
        },
        {
          "name": "Schmidt Number",
          "Sc": "Sc = \u03bd/D = \u03bc/(\u03c1 * D_AB)",
          "description": "Ratio of momentum diffusivity to mass diffusivity",
          "usage_context": "Used in mass transfer problems to relate velocity and concentration boundary layers"
        },
        {
          "name": "Nusselt Number",
          "formula": "Nu = (h * L)/k",
          "description": "Dimensionless heat transfer coefficient",
          "usage_context": "Relates convective to conductive heat transfer at a boundary, used to calculate heat transfer rates"
        },
        {
          "name": "Sherwood Number",
          "formula": "Sh = (h_m * L)/D_AB",
          "description": "Dimensionless mass transfer coefficient",
          "usage_context": "Mass transfer equivalent of Nusselt number, used to calculate mass transfer rates"
        },
        {
          "name": "Skin Friction Coefficient",
          "formula": "C_f = \u03c4_w/(0.5 * \u03c1 * u_\u221e^2)",
          "description": "Dimensionless wall shear stress",
          "usage_context": "Used to quantify drag force due to viscous effects in boundary layers"
        },
        {
          "name": "Reynolds Analogy",
          "formula": "St = C_f/2",
          "description": "Relates momentum transfer to heat transfer",
          "usage_context": "Used when Pr \u2248 1 to estimate heat transfer coefficients from known friction coefficients"
        }
      ]
    },
    "raw_response": "CORE:\n**Response:**\n\n```json\n{\n  \"overall_goal\": \"Master the fundamental concepts of convection heat and mass transfer, focusing on boundary layer theory, convection coefficients, flow regimes, governing equations, and dimensionless parameters.\",\n  \"total_study_day\": \"7\",\n  \"hour_per_day\": \"2.0\",\n  \"core_concepts\": [\n    {\n      \"name\": \"Boundary Layer Fundamentals\",\n      \"explanation\": \"Understanding the development of velocity, thermal, and concentration boundary layers in fluid flow.\",\n      \"importance\": \"Critical for analyzing heat and mass transfer in convective systems.\"\n    },\n    {\n      \"name\": \"Convection Coefficients\",\n      \"explanation\": \"Differentiating between local and average convection coefficients and their applications.\",\n      \"importance\": \"Essential for calculating heat and mass transfer rates.\"\n    },\n    {\n      \"name\": \"Flow Regimes\",\n      \"explanation\": \"Distinguishing between laminar and turbulent flow and their impact on transfer processes.\",\n      \"importance\": \"Determines the efficiency and behavior of convective systems.\"\n    },\n    {\n      \"name\": \"Governing Equations\",\n      \"explanation\": \"Deriving and applying simplified forms of momentum, energy, and species equations.\",\n      \"importance\": \"Forms the mathematical foundation for convective analysis.\"\n    },\n    {\n      \"name\": \"Dimensionless Parameters\",\n      \"explanation\": \"Understanding key parameters like Reynolds, Prandtl, and Schmidt numbers and their significance.\",\n      \"importance\": \"Enables scaling and comparison of different convective systems.\"\n    }\n  ],\n  \"general_tip\": [\n    \"Work through examples before looking at solutions to reinforce understanding.\",\n    \"Sketch boundary layer profiles to visualize different flow conditions.\",\n    \"Create comparison tables for key parameters like Prandtl numbers.\",\n    \"Apply heat transfer solutions to equivalent mass transfer problems for deeper learning.\",\n    \"Summarize key points at the end of each session to reinforce retention.\"\n  ]\n}\n```\n\nSCHEDULE:\n```json\n{\n  \"daily_schedule\": [\n    {\n      \"day\": 1,\n      \"date\": null,\n      \"focus_area\": \"Boundary Layer Fundamentals\",\n      \"study_item\": [\n        {\n          \"topic\": \"Boundary Layer Concepts\",\n          \"description\": \"Read and take notes on Section 6.1 (Boundary Layer Concepts)\",\n          \"duration_minutes\": 30,\n          \"resource\": [\n            {\n              \"title\": \"Section 6.1\",\n              \"type\": \"textbook\",\n              \"url\": null,\n              \"description\": \"Introduction to boundary layers\"\n            }\n          ],\n          \"is_completed\": false,\n          \"learning_objectives\": [\n            \"Understand the concept of boundary layers\",\n            \"Identify different types of boundary layers\"\n          ],\n          \"priority\": \"high\"\n        },\n        {\n          \"topic\": \"Velocity Boundary Layer\",\n          \"description\": \"Study velocity boundary layer development and thickness\",\n          \"duration_minutes\": 30,\n          \"resource\": [\n            {\n              \"title\": \"Section 6.1\",\n              \"type\": \"textbook\",\n              \"url\": null,\n              \"description\": \"Velocity boundary layer details\"\n            }\n          ],\n          \"is_completed\": false,\n          \"learning_objectives\": [\n            \"Understand velocity boundary layer development\",\n            \"Calculate boundary layer thickness\"\n          ],\n          \"priority\": \"high\"\n        },\n        {\n          \"topic\": \"Thermal and Concentration Boundary Layers\",\n          \"description\": \"Examine thermal and concentration boundary layers\",\n          \"duration_minutes\": 30,\n          \"resource\": [\n            {\n              \"title\": \"Section 6.1\",\n              \"type\": \"textbook\",\n              \"url\": null,\n              \"description\": \"Thermal and concentration boundary layers\"\n            }\n          ],\n          \"is_completed\": false,\n          \"learning_objectives\": [\n            \"Differentiate between thermal and concentration boundary layers\",\n            \"Understand their significance in heat and mass transfer\"\n          ],\n          \"priority\": \"medium\"\n        }\n      ],\n      \"summary\": \"Gained understanding of boundary layer fundamentals including velocity, thermal, and concentration boundary layers.\",\n      \"learning_goals\": [\n        \"Master boundary layer concepts\",\n        \"Understand boundary layer thickness calculations\"\n      ],\n      \"review_topics\": []\n    },\n    {\n      \"day\": 2,\n      \"date\": null,\n      \"focus_area\": \"Convection Coefficients\",\n      \"study_item\": [\n        {\n          \"topic\": \"Local and Average Coefficients\",\n          \"description\": \"Study Section 6.2 (Local and Average Coefficients)\",\n          \"duration_minutes\": 45,\n          \"resource\": [\n            {\n              \"title\": \"Section 6.2\",\n              \"type\": \"textbook\",\n              \"url\": null,\n              \"description\": \"Convection coefficients\"\n            }\n          ],\n          \"is_completed\": false,\n          \"learning_objectives\": [\n            \"Differentiate between local and average coefficients\",\n            \"Understand their applications\"\n          ],\n          \"priority\": \"high\"\n        },\n        {\n          \"topic\": \"Mass Transfer Application\",\n          \"description\": \"Analyze Example 6.2 (mass transfer application)\",\n          \"duration_minutes\": 45,\n          \"resource\": [\n            {\n              \"title\": \"Example 6.2\",\n              \"type\": \"textbook\",\n              \"url\": null,\n              \"description\": \"Mass transfer application example\"\n            }\n          ],\n          \"is_completed\": false,\n          \"learning_objectives\": [\n            \"Apply convection coefficients to mass transfer problems\",\n            \"Solve practical problems using coefficients\"\n          ],\n          \"priority\": \"high\"\n        }\n      ],\n      \"summary\": \"Learned about local and average convection coefficients and their applications in mass transfer.\",\n      \"learning_goals\": [\n        \"Understand convection coefficients\",\n        \"Apply coefficients to practical problems\"\n      ],\n      \"review_topics\": [\n        \"Boundary Layer Fundamentals\"\n      ]\n    },\n    {\n      \"day\": 3,\n      \"date\": null,\n      \"focus_area\": \"Flow Regimes\",\n      \"study_item\": [\n        {\n          \"topic\": \"Laminar vs. Turbulent Flow\",\n          \"description\": \"Study Section 6.3 (Laminar vs. Turbulent Flow)\",\n          \"duration_minutes\": 45,\n          \"resource\": [\n            {\n              \"title\": \"Section 6.3\",\n              \"type\": \"textbook\",\n              \"url\": null,\n              \"description\": \"Flow regimes\"\n            }\n          ],\n          \"is_completed\": false,\n          \"learning_objectives\": [\n            \"Differentiate between laminar and turbulent flow\",\n            \"Understand flow characteristics\"\n          ],\n          \"priority\": \"high\"\n        },\n        {\n          \"topic\": \"Transition Criteria\",\n          \"description\": \"Examine transition criteria and critical Reynolds numbers\",\n          \"duration_minutes\": 30,\n          \"resource\": [\n            {\n              \"title\": \"Section 6.3\",\n              \"type\": \"textbook\",\n              \"url\": null,\n              \"description\": \"Transition criteria\"\n            }\n          ],\n          \"is_completed\": false,\n          \"learning_objectives\": [\n            \"Understand transition criteria\",\n            \"Calculate critical Reynolds numbers\"\n          ],\n          \"priority\": \"medium\"\n        }\n      ],\n      \"summary\": \"Studied laminar and turbulent flow characteristics and transition criteria.\",\n      \"learning_goals\": [\n        \"Differentiate flow regimes\",\n        \"Understand transition criteria\"\n      ],\n      \"review_topics\": [\n        \"Convection Coefficients\"\n      ]\n    },\n    {\n      \"day\": 4,\n      \"date\": null,\n      \"focus_area\": \"Boundary Layer Equations\",\n      \"study_item\": [\n        {\n          \"topic\": \"Governing Equations\",\n          \"description\": \"Study Section 6.4 (Governing Equations)\",\n          \"duration_minutes\": 60,\n          \"resource\": [\n            {\n              \"title\": \"Section 6.4\",\n              \"type\": \"textbook\",\n              \"url\": null,\n              \"description\": \"Governing equations\"\n            }\n          ],\n          \"is_completed\": false,\n          \"learning_objectives\": [\n            \"Understand governing equations for boundary layers\",\n            \"Identify key terms in equations\"\n          ],\n          \"priority\": \"high\"\n        },\n        {\n          \"topic\": \"Simplified Equations\",\n          \"description\": \"Derive simplified forms of momentum, energy, and species equations\",\n          \"duration_minutes\": 30,\n          \"resource\": [\n            {\n              \"title\": \"Section 6.4\",\n              \"type\": \"textbook\",\n              \"url\": null,\n              \"description\": \"Simplified equations\"\n            }\n          ],\n          \"is_completed\": false,\n          \"learning_objectives\": [\n            \"Derive simplified equations\",\n            \"Understand their applications\"\n          ],\n          \"priority\": \"medium\"\n        }\n      ],\n      \"summary\": \"Learned about governing equations for boundary layers and their simplified forms.\",\n      \"learning_goals\": [\n        \"Understand boundary layer equations\",\n        \"Derive simplified forms\"\n      ],\n      \"review_topics\": [\n        \"Flow Regimes\"\n      ]\n    },\n    {\n      \"day\": 5,\n      \"date\": null,\n      \"focus_area\": \"Dimensionless Parameters\",\n      \"study_item\": [\n        {\n          \"topic\": \"Normalized Equations\",\n          \"description\": \"Study Section 6.5 (Normalized Equations)\",\n          \"duration_minutes\": 45,\n          \"resource\": [\n            {\n              \"title\": \"Section 6.5\",\n              \"type\": \"textbook\",\n              \"url\": null,\n              \"description\": \"Normalized equations\"\n            }\n          ],\n          \"is_completed\": false,\n          \"learning_objectives\": [\n            \"Understand normalization of equations\",\n            \"Identify key dimensionless parameters\"\n          ],\n          \"priority\": \"high\"\n        },\n        {\n          \"topic\": \"Dimensionless Parameters\",\n          \"description\": \"Learn about Re, Pr, Sc and their physical significance\",\n          \"duration_minutes\": 30,\n          \"resource\": [\n            {\n              \"title\": \"Section 6.5\",\n              \"type\": \"textbook\",\n              \"url\": null,\n              \"description\": \"Dimensionless parameters\"\n            }\n          ],\n          \"is_completed\": false,\n          \"learning_objectives\": [\n            \"Understand Reynolds, Prandtl, and Schmidt numbers\",\n            \"Apply dimensionless parameters\"\n          ],\n          \"priority\": \"high\"\n        }\n      ],\n      \"summary\": \"Studied normalized equations and key dimensionless parameters in convection.\",\n      \"learning_goals\": [\n        \"Understand dimensionless parameters\",\n        \"Apply normalization techniques\"\n      ],\n      \"review_topics\": [\n        \"Boundary Layer Equations\"\n      ]\n    },\n    {\n      \"day\": 6,\n      \"date\": null,\n      \"focus_area\": \"Analogies\",\n      \"study_item\": [\n        {\n          \"topic\": \"Heat and Mass Transfer Analogies\",\n          \"description\": \"Study Section 6.7 (Heat and Mass Transfer Analogies)\",\n          \"duration_minutes\": 45,\n          \"resource\": [\n            {\n              \"title\": \"Section 6.7\",\n              \"type\": \"textbook\",\n              \"url\": null,\n              \"description\": \"Heat and mass transfer analogies\"\n            }\n          ],\n          \"is_completed\": false,\n          \"learning_objectives\": [\n            \"Understand analogies between heat and mass transfer\",\n            \"Apply analogies to solve problems\"\n          ],\n          \"priority\": \"high\"\n        },\n        {\n          \"topic\": \"Reynolds Analogy\",\n          \"description\": \"Examine the Reynolds analogy and its modifications\",\n          \"duration_minutes\": 30,\n          \"resource\": [\n            {\n              \"title\": \"Section 6.7\",\n              \"type\": \"textbook\",\n              \"url\": null,\n              \"description\": \"Reynolds analogy\"\n            }\n          ],\n          \"is_completed\": false,\n          \"learning_objectives\": [\n            \"Understand Reynolds analogy\",\n            \"Apply modified forms\"\n          ],\n          \"priority\": \"medium\"\n        }\n      ],\n      \"summary\": \"Learned about heat and mass transfer analogies including the Reynolds analogy.\",\n      \"learning_goals\": [\n        \"Understand transfer analogies\",\n        \"Apply Reynolds analogy\"\n      ],\n      \"review_topics\": [\n        \"Dimensionless Parameters\"\n      ]\n    },\n    {\n      \"day\": 7,\n      \"date\": null,\n      \"focus_area\": \"Review and Application\",\n      \"study_item\": [\n        {\n          \"topic\": \"Key Concepts Review\",\n          \"description\": \"Review all key concepts and equations\",\n          \"duration_minutes\": 45,\n          \"resource\": [\n            {\n              \"title\": \"Chapter 6 Summary\",\n              \"type\": \"textbook\",\n              \"url\": null,\n              \"description\": \"Key concepts summary\"\n            }\n          ],\n          \"is_completed\": false,\n          \"learning_objectives\": [\n            \"Consolidate understanding of key concepts\",\n            \"Review important equations\"\n          ],\n          \"priority\": \"high\"\n        },\n        {\n          \"topic\": \"Practice Problems\",\n          \"description\": \"Work through additional practice problems\",\n          \"duration_minutes\": 30,\n          \"resource\": [\n            {\n              \"title\": \"Practice Problems\",\n              \"type\": \"textbook\",\n              \"url\": null,\n              \"description\": \"Additional problems\"\n            }\n          ],\n          \"is_completed\": false,\n          \"learning_objectives\": [\n            \"Apply concepts to solve problems\",\n            \"Identify areas needing improvement\"\n          ],\n          \"priority\": \"high\"\n        }\n      ],\n      \"summary\": \"Reviewed all key concepts and practiced applying them to problems.\",\n      \"learning_goals\": [\n        \"Consolidate understanding\",\n        \"Apply knowledge to problems\"\n      ],\n      \"review_topics\": [\n        \"All previous topics\"\n      ]\n    }\n  ]\n}\n```\n\nFORMULAS:\n```json\n{\n  \"key_formulas\": [\n    {\n      \"name\": \"Reynolds Number\",\n      \"formula\": \"Re = (\u03c1 * u * L)/\u03bc\",\n      \"description\": \"Dimensionless number that characterizes flow regimes (laminar vs. turbulent)\",\n      \"usage_context\": \"Used to determine flow characteristics in convection problems, typically with Re_crit \u2248 5\u00d710^5 for flat plate transition\"\n    },\n    {\n      \"name\": \"Prandtl Number\",\n      \"formula\": \"Pr = \u03bd/\u03b1 = (\u03bc * c_p)/k\",\n      \"description\": \"Ratio of momentum diffusivity to thermal diffusivity\",\n      \"usage_context\": \"Important for determining relative thickness of velocity and thermal boundary layers in heat transfer problems\"\n    },\n    {\n      \"name\": \"Schmidt Number\",\n      \"Sc\": \"Sc = \u03bd/D = \u03bc/(\u03c1 * D_AB)\",\n      \"description\": \"Ratio of momentum diffusivity to mass diffusivity\",\n      \"usage_context\": \"Used in mass transfer problems to relate velocity and concentration boundary layers\"\n    },\n    {\n      \"name\": \"Nusselt Number\",\n      \"formula\": \"Nu = (h * L)/k\",\n      \"description\": \"Dimensionless heat transfer coefficient\",\n      \"usage_context\": \"Relates convective to conductive heat transfer at a boundary, used to calculate heat transfer rates\"\n    },\n    {\n      \"name\": \"Sherwood Number\",\n      \"formula\": \"Sh = (h_m * L)/D_AB\",\n      \"description\": \"Dimensionless mass transfer coefficient\",\n      \"usage_context\": \"Mass transfer equivalent of Nusselt number, used to calculate mass transfer rates\"\n    },\n    {\n      \"name\": \"Skin Friction Coefficient\",\n      \"formula\": \"C_f = \u03c4_w/(0.5 * \u03c1 * u_\u221e^2)\",\n      \"description\": \"Dimensionless wall shear stress\",\n      \"usage_context\": \"Used to quantify drag force due to viscous effects in boundary layers\"\n    },\n    {\n      \"name\": \"Reynolds Analogy\",\n      \"formula\": \"St = C_f/2\",\n      \"description\": \"Relates momentum transfer to heat transfer\",\n      \"usage_context\": \"Used when Pr \u2248 1 to estimate heat transfer coefficients from known friction coefficients\"\n    }\n  ]\n}\n```"
  }
}