{
  "raw_response": "CORE:\n```json\n{\n  \"overall_goal\": \"Master the fundamentals of convection heat transfer, focusing on boundary layers, dimensionless parameters, governing equations, and practical applications.\",\n  \"total_study_day\": \"7\",\n  \"hour_per_day\": \"2.0\",\n  \"core_concepts\": [\n    {\n      \"name\": \"Boundary layer development\",\n      \"explanation\": \"Understanding the development of velocity, thermal, and concentration boundary layers in fluid flow over surfaces.\",\n      \"importance\": \"Fundamental to analyzing heat and mass transfer in convective systems.\",\n      \"related_concepts\": [\n        \"Velocity boundary layer\",\n        \"Thermal boundary layer\"\n      ],\n      \"examples\": [\n        \"Heat transfer over a flat plate\",\n        \"Cooling of electronic components\"\n      ],\n      \"difficulty_level\": \"intermediate\"\n    },\n    {\n      \"name\": \"Local vs average convection coefficients\",\n      \"explanation\": \"Distinction between point-specific and surface-averaged heat/mass transfer coefficients.\",\n      \"importance\": \"Crucial for accurate calculation of overall heat transfer rates.\",\n      \"related_concepts\": [\n        \"Nusselt number\",\n        \"Heat transfer rate calculations\"\n      ],\n      \"examples\": [\n        \"Calculating heat loss from a pipe\",\n        \"Determining cooling rates for industrial processes\"\n      ],\n      \"difficulty_level\": \"intermediate\"\n    },\n    {\n      \"name\": \"Laminar vs turbulent flow characteristics\",\n      \"explanation\": \"Comparison of flow regimes and their impact on heat transfer mechanisms.\",\n      \"importance\": \"Determines the mathematical approach and correlations needed for analysis.\",\n      \"related_concepts\": [\n        \"Reynolds number\",\n        \"Transition criteria\"\n      ],\n      \"examples\": [\n        \"Flow over aircraft wings\",\n        \"Heat exchanger design\"\n      ],\n      \"difficulty_level\": \"basic\"\n    },\n    {\n      \"name\": \"Boundary layer equations\",\n      \"explanation\": \"Simplified governing equations for momentum, energy and mass transfer in boundary layers.\",\n      \"importance\": \"Foundation for analytical solutions to convection problems.\",\n      \"related_concepts\": [\n        \"Navier-Stokes equations\",\n        \"Similarity solutions\"\n      ],\n      \"examples\": [\n        \"Flat plate heat transfer analysis\",\n        \"Pipe flow calculations\"\n      ],\n      \"difficulty_level\": \"advanced\"\n    },\n    {\n      \"name\": \"Heat and mass transfer analogies\",\n      \"explanation\": \"Relationships between different transfer processes based on dimensionless parameters.\",\n      \"importance\": \"Allows prediction of one transfer process from knowledge of another.\",\n      \"related_concepts\": [\n        \"Reynolds analogy\",\n        \"Chilton-Colburn analogy\"\n      ],\n      \"examples\": [\n        \"Evaporative cooling systems\",\n        \"Mass transfer in chemical reactors\"\n      ],\n      \"difficulty_level\": \"intermediate\"\n    }\n  ],\n  \"general_tip\": [\n    \"Create concept maps to visualize relationships between parameters\",\n    \"Use color-coding for different boundary layer types\",\n    \"Practice deriving key equations from first principles\",\n    \"Work problems both analytically and numerically\",\n    \"Relate concepts to real-world examples\",\n    \"Review daily with spaced repetition technique\",\n    \"Form study groups to explain concepts to peers\"\n  ]\n}\n```\n\nSCHEDULE:\n            {\n  \"daily_schedule\": [\n    {\n      \"day\": 1,\n      \"focus_area\": \"Boundary Layer Fundamentals\",\n      \"study_item\": [\n        {\n          \"topic\": \"Boundary Layer Concept\",\n          \"description\": \"Read and summarize Section 6.1 on boundary layer concepts\",\n          \"duration_minutes\": 30\n        },\n        {\n          \"topic\": \"Velocity Boundary Layer\",\n          \"description\": \"Study velocity boundary layer development (Equations 6.1-6.2)\",\n          \"duration_minutes\": 30\n        },\n        {\n          \"topic\": \"Thermal Boundary Layer\",\n          \"description\": \"Analyze thermal boundary layer formation (Equations 6.3-6.5)\",\n          \"duration_minutes\": 30\n        },\n        {\n          \"topic\": \"Heat Transfer Coefficients\",\n          \"description\": \"Work through Example 6.1 on heat transfer coefficients\",\n          \"duration_minutes\": 30\n        }\n      ],\n      \"summary\": \"Learned the fundamentals of boundary layers, including velocity and thermal boundary layers, and their role in heat transfer.\",\n      \"learning_goals\": [\n        \"Understand boundary layer development\",\n        \"Grasp the concept of heat transfer coefficients\"\n      ],\n      \"review_topics\": []\n    },\n    {\n      \"day\": 2,\n      \"focus_area\": \"Convection Coefficients\",\n      \"study_item\": [\n        {\n          \"topic\": \"Local vs Average Coefficients\",\n          \"description\": \"Review local vs average coefficients (Section 6.2)\",\n          \"duration_minutes\": 30\n        },\n        {\n          \"topic\": \"Mass Transfer Analogies\",\n          \"description\": \"Study mass transfer analogies (Equations 6.6-6.9)\",\n          \"duration_minutes\": 30\n        },\n        {\n          \"topic\": \"Mass Transfer Application\",\n          \"description\": \"Solve Example 6.2 on mass transfer applications\",\n          \"duration_minutes\": 30\n        },\n        {\n          \"topic\": \"Concentration Boundary Layer\",\n          \"description\": \"Practice problems on concentration boundary layers\",\n          \"duration_minutes\": 30\n        }\n      ],\n      \"summary\": \"Explored convection coefficients, mass transfer analogies, and their applications in boundary layers.\",\n      \"learning_goals\": [\n        \"Differentiate between local and average coefficients\",\n        \"Apply mass transfer analogies to boundary layers\"\n      ],\n      \"review_topics\": [\n        \"Boundary Layer Fundamentals\"\n      ]\n    },\n    {\n      \"day\": 3,\n      \"focus_area\": \"Flow Regimes\",\n      \"study_item\": [\n        {\n          \"topic\": \"Laminar vs Turbulent Flow\",\n          \"description\": \"Compare laminar vs turbulent flow (Section 6.3)\",\n          \"duration_minutes\": 45\n        },\n        {\n          \"topic\": \"Transition Criteria\",\n          \"description\": \"Analyze transition criteria and Reynolds number\",\n          \"duration_minutes\": 45\n        },\n        {\n          \"topic\": \"Flow Regime Effects\",\n          \"description\": \"Work through Example 6.4 on flow regime effects\",\n          \"duration_minutes\": 30\n        }\n      ],\n      \"summary\": \"Studied the differences between laminar and turbulent flow, transition criteria, and their impact on boundary layers.\",\n      \"learning_goals\": [\n        \"Understand flow regime characteristics\",\n        \"Analyze transition criteria\"\n      ],\n      \"review_topics\": [\n        \"Convection Coefficients\"\n      ]\n    },\n    {\n      \"day\": 4,\n      \"focus_area\": \"Governing Equations\",\n      \"study_item\": [\n        {\n          \"topic\": \"Boundary Layer Equations\",\n          \"description\": \"Study simplified boundary layer equations (6.27-6.30)\",\n          \"duration_minutes\": 60\n        },\n        {\n          \"topic\": \"Assumptions and Limitations\",\n          \"description\": \"Examine assumptions and limitations of boundary layer equations\",\n          \"duration_minutes\": 30\n        },\n        {\n          \"topic\": \"Momentum/Energy Equations\",\n          \"description\": \"Solve problems involving momentum/energy equations\",\n          \"duration_minutes\": 30\n        }\n      ],\n      \"summary\": \"Learned the governing equations for boundary layers, their assumptions, and applications in solving momentum and energy problems.\",\n      \"learning_goals\": [\n        \"Master boundary layer equations\",\n        \"Understand assumptions and limitations\"\n      ],\n      \"review_topics\": [\n        \"Flow Regimes\"\n      ]\n    },\n    {\n      \"day\": 5,\n      \"focus_area\": \"Dimensionless Analysis\",\n      \"study_item\": [\n        {\n          \"topic\": \"Similarity Parameters\",\n          \"description\": \"Learn similarity parameters (Re, Pr, Sc, Nu, Sh)\",\n          \"duration_minutes\": 45\n        },\n        {\n          \"topic\": \"Normalized Equations\",\n          \"description\": \"Study normalized equations (Table 6.1)\",\n          \"duration_minutes\": 45\n        },\n        {\n          \"topic\": \"Dimensionless Groups\",\n          \"description\": \"Work through Example 6.5 on dimensionless groups\",\n          \"duration_minutes\": 30\n        }\n      ],\n      \"summary\": \"Explored dimensionless analysis, similarity parameters, and their role in boundary layer problems.\",\n      \"learning_goals\": [\n        \"Understand dimensionless groups\",\n        \"Apply similarity parameters\"\n      ],\n      \"review_topics\": [\n        \"Governing Equations\"\n      ]\n    },\n    {\n      \"day\": 6,\n      \"focus_area\": \"Analogies\",\n      \"study_item\": [\n        {\n          \"topic\": \"Heat-Mass Transfer Analogy\",\n          \"description\": \"Study heat-mass transfer analogy (Section 6.7.1)\",\n          \"duration_minutes\": 60\n        },\n        {\n          \"topic\": \"Reynolds Analogy\",\n          \"description\": \"Analyze Reynolds analogy (Equations 6.66-6.69)\",\n          \"duration_minutes\": 30\n        },\n        {\n          \"topic\": \"Practical Applications\",\n          \"description\": \"Solve Example 6.7 on practical applications\",\n          \"duration_minutes\": 30\n        }\n      ],\n      \"summary\": \"Learned heat-mass transfer analogies, Reynolds analogy, and their practical applications.\",\n      \"learning_goals\": [\n        \"Understand heat-mass transfer analogies\",\n        \"Apply Reynolds analogy\"\n      ],\n      \"review_topics\": [\n        \"Dimensionless Analysis\"\n      ]\n    },\n    {\n      \"day\": 7,\n      \"focus_area\": \"Applications & Review\",\n      \"study_item\": [\n        {\n          \"topic\": \"Evaporative Cooling\",\n          \"description\": \"Study evaporative cooling (Example 6.8)\",\n          \"duration_minutes\": 60\n        },\n        {\n          \"topic\": \"Key Concepts Review\",\n          \"description\": \"Review all key concepts\",\n          \"duration_minutes\": 30\n        },\n        {\n          \"topic\": \"Practice Problems\",\n          \"description\": \"Complete practice problems from chapter\",\n          \"duration_minutes\": 30\n        }\n      ],\n      \"summary\": \"Reviewed key concepts, studied evaporative cooling, and practiced problems to reinforce learning.\",\n      \"learning_goals\": [\n        \"Apply concepts to practical problems\",\n        \"Reinforce understanding of boundary layers\"\n      ],\n      \"review_topics\": [\n        \"Analogies\"\n      ]\n    }\n  ]\n}\n\nFORMULAS:\n```json\n{\n  \"overall_goal\": \"Master the fundamental concept of Convection Heat Transfer, focusing on Boundary Layer Development, Convection Coefficients, and Flow Regimes.\",\n  \"total_study_day\": \"7\",\n  \"hour_per_day\": \"2.0\",\n  \"core_concepts\": [\n    {\n      \"name\": \"Boundary Layer Development\",\n      \"explanation\": \"The boundary layer is the region near a surface where the velocity, temperature, or concentration of a fluid changes from the free stream value to the surface value. It includes velocity, thermal, and concentration boundary layers.\",\n      \"importance\": \"Understanding boundary layers is crucial for analyzing heat and mass transfer in fluid flows, as it determines the resistance to heat and mass transfer.\",\n      \"related_concepts\": [\n        \"Velocity Boundary Layer\",\n        \"Thermal Boundary Layer\",\n        \"Concentration Boundary Layer\"\n      ],\n      \"example\": [\n        \"Velocity boundary layer on an airplane wing affects drag and lift.\",\n        \"Thermal boundary layer in a heat exchanger affects heat transfer efficiency.\"\n      ],\n      \"difficulty_level\": \"basic\"\n    },\n    {\n      \"name\": \"Convection Coefficients\",\n      \"explanation\": \"Convection coefficients quantify the rate of heat or mass transfer between a surface and a fluid. They can be local or average, depending on the spatial variation.\",\n      \"importance\": \"These coefficients are essential for designing thermal systems like heat exchangers and cooling systems.\",\n      \"related_concepts\": [\n        \"Local Convection Coefficient\",\n        \"Average Convection Coefficient\",\n        \"Mass Transfer Coefficient\"\n      ],\n      \"example\": [\n        \"Calculating the heat transfer coefficient for a radiator.\",\n        \"Determining the mass transfer coefficient in a chemical reactor.\"\n      ],\n      \"difficulty_level\": \"basic\"\n    },\n    {\n      \"name\": \"Flow Regimes\",\n      \"explanation\": \"Flow can be laminar (smooth and orderly) or turbulent (chaotic and irregular). The transition between these regimes is determined by the Reynolds number.\",\n      \"importance\": \"Different flow regimes have significantly different heat and mass transfer characteristics, affecting system performance.\",\n      \"related_concepts\": [\n        \"Laminar Flow\",\n        \"Turbulent Flow\",\n        \"Reynolds Number\"\n      ],\n      \"example\": [\n        \"Laminar flow in a pipe results in lower heat transfer compared to turbulent flow.\",\n        \"Turbulent flow enhances mixing in chemical reactors.\"\n      ],\n      \"difficulty_level\": \"basic\"\n    },\n    {\n      \"name\": \"Boundary Layer Equations\",\n      \"explanation\": \"Simplified equations derived from the Navier-Stokes equations that describe the behavior of boundary layers under certain assumptions.\",\n      \"importance\": \"These equations allow for analytical and numerical solutions to boundary layer problems, simplifying complex fluid dynamics.\",\n      \"related_concepts\": [\n        \"Momentum Equation\",\n        \"Energy Equation\",\n        \"Continuity Equation\"\n      ],\n      \"example\": [\n        \"Solving the boundary layer equations to find velocity profile over a flat plate.\",\n        \"Using the energy equation to determine temperature distribution in a thermal boundary layer.\"\n      ],\n      \"difficulty_level\": \"intermediate\"\n    },\n    {\n      \"name\": \"Dimensionless Numbers\",\n      \"explanation\": \"Dimensionless groups like Reynolds, Prandtl, and Nusselt numbers characterize fluid flow and heat transfer phenomena.\",\n      \"importance\": \"These numbers simplify the analysis of complex systems by reducing the number of variables and scaling effects.\",\n      \"related_concepts\": [\n        \"Reynolds Number\",\n        \"Prandtl Number\",\n        \"Nusselt Number\"\n      ],\n      \"example\": [\n        \"Using the Reynolds number to predict flow regime in a pipe.\",\n        \"Prandtl number indicates the relative thickness of velocity and thermal boundary layers.\"\n      ],\n      \"difficulty_level\": \"intermediate\"\n    }\n  ],\n  \"daily_schedule\": [\n    {\n      \"day\": 1,\n      \"date\": null,\n      \"focus_area\": \"Boundary Layer Fundamentals\",\n      \"study_item\": [\n        {\n          \"topic\": \"Boundary Layer Concept\",\n          \"description\": \"Read and summarize Section 6.1 on boundary layer concepts.\",\n          \"duration_minutes\": 30,\n          \"resource\": [\n            {\n              \"title\": \"Convection Heat Transfer Textbook\",\n              \"type\": \"textbook\",\n              \"url\": null,\n              \"description\": \"Chapter 6, Section 6.1\"\n            }\n          ],\n          \"is_completed\": false,\n          \"learning_objectives\": [\n            \"Understand the concept of boundary layers.\",\n            \"Differentiate between velocity, thermal, and concentration boundary layers.\"\n          ],\n          \"priority\": \"high\"\n        },\n        {\n          \"topic\": \"Velocity Boundary Layer\",\n          \"description\": \"Study velocity boundary layer development (Equations 6.1-6.2).\",\n          \"duration_minutes\": 30,\n          \"resource\": [\n            {\n              \"title\": \"Convection Heat Transfer Textbook\",\n              \"type\": \"textbook\",\n              \"url\": null,\n              \"description\": \"Equations 6.1-6.2\"\n            }\n          ],\n          \"is_completed\": false,\n          \"learning_objectives\": [\n            \"Understand the development of velocity boundary layers.\",\n            \"Analyze the governing equations for velocity boundary layers.\"\n          ],\n          \"priority\": \"high\"\n        },\n        {\n          \"topic\": \"Thermal Boundary Layer\",\n          \"description\": \"Analyze thermal boundary layer formation (Equations 6.3-6.5).\",\n          \"duration_minutes\": 30,\n          \"resource\": [\n            {\n              \"title\": \"Convection Heat Transfer Textbook\",\n              \"type\": \"textbook\",\n              \"url\": null,\n              \"description\": \"Equations 6.3-6.5\"\n            }\n          ],\n          \"is_completed\": false,\n          \"learning_objectives\": [\n            \"Understand the development of thermal boundary layers.\",\n            \"Analyze the governing equations for thermal boundary layers.\"\n          ],\n          \"priority\": \"high\"\n        },\n        {\n          \"topic\": \"Heat Transfer Coefficient\",\n          \"description\": \"Work through Example 6.1 on heat transfer coefficients.\",\n          \"duration_minutes\": 30,\n          \"resource\": [\n            {\n              \"title\": \"Convection Heat Transfer Textbook\",\n              \"type\": \"textbook\",\n              \"url\": null,\n              \"description\": \"Example 6.1\"\n            }\n          ],\n          \"is_completed\": false,\n          \"learning_objectives\": [\n            \"Calculate heat transfer coefficients.\",\n            \"Apply boundary layer concepts to practical problems.\"\n          ],\n          \"priority\": \"high\"\n        }\n      ],\n      \"summary\": \"Learned the fundamentals of boundary layers, including velocity and thermal boundary layers, and applied these concepts to calculate heat transfer coefficients.\",\n      \"learning_goals\": [\n        \"Understand boundary layer concepts.\",\n        \"Analyze velocity and thermal boundary layers.\"\n      ],\n      \"review_topics\": []\n    },\n    {\n      \"day\": 2,\n      \"date\": null,\n      \"focus_area\": \"Convection Coefficients\",\n      \"study_item\": [\n        {\n          \"topic\": \"Local vs Average Coefficients\",\n          \"description\": \"Review local vs average coefficients (Section 6.2).\",\n          \"duration_minutes\": 30,\n          \"resource\": [\n            {\n              \"title\": \"Convection Heat Transfer Textbook\",\n              \"type\": \"textbook\",\n              \"url\": null,\n              \"description\": \"Section 6.2\"\n            }\n          ],\n          \"is_completed\": false,\n          \"learning_objectives\": [\n            \"Differentiate between local and average convection coefficients.\",\n            \"Understand their significance in heat transfer.\"\n          ],\n          \"priority\": \"high\"\n        },\n        {\n          \"topic\": \"Mass Transfer Analogy\",\n          \"description\": \"Study mass transfer analogy (Equations 6.6-6.9).\",\n          \"duration_minutes\": 30,\n          \"resource\": [\n            {\n              \"title\": \"Convection Heat Transfer Textbook\",\n              \"type\": \"textbook\",\n              \"url\": null,\n              \"description\": \"Equations 6.6-6.9\"\n            }\n          ],\n          \"is_completed\": false,\n          \"learning_objectives\": [\n            \"Understand the analogy between heat and mass transfer.\",\n            \"Analyze the governing equations for mass transfer.\"\n          ],\n          \"priority\": \"high\"\n        },\n        {\n          \"topic\": \"Mass Transfer Application\",\n          \"description\": \"Solve Example 6.2 on mass transfer applications.\",\n          \"duration_minutes\": 30,\n          \"resource\": [\n            {\n              \"title\": \"Convection Heat Transfer Textbook\",\n              \"type\": \"textbook\",\n              \"url\": null,\n              \"description\": \"Example 6.2\"\n            }\n          ],\n          \"is_completed\": false,\n          \"learning_objectives\": [\n            \"Apply mass transfer concepts to practical problems.\",\n            \"Calculate mass transfer coefficients.\"\n          ],\n          \"priority\": \"high\"\n        },\n        {\n          \"topic\": \"Concentration Boundary Layer\",\n          \"description\": \"Practice problems on concentration boundary layers.\",\n          \"duration_minutes\": 30,\n          \"resource\": [\n            {\n              \"title\": \"Convection Heat Transfer Textbook\",\n              \"type\": \"textbook\",\n              \"url\": null,\n              \"description\": \"Practice Problems\"\n            }\n          ],\n          \"is_completed\": false,\n          \"learning_objectives\": [\n            \"Understand concentration boundary layers.\",\n            \"Solve problems involving mass transfer.\"\n          ],\n          \"priority\": \"high\"\n        }\n      ],\n      \"summary\": \"Reviewed local and average convection coefficients, studied mass transfer analogies, and applied these concepts to solve problems involving mass transfer and concentration boundary layers.\",\n      \"learning_goals\": [\n        \"Understand convection coefficients.\",\n        \"Apply mass transfer analogies.\"\n      ],\n      \"review_topics\": [\n        \"Boundary Layer Fundamentals\"\n      ]\n    },\n    {\n      \"day\": 3,\n      \"date\": null,\n      \"focus_area\": \"Flow Regimes\",\n      \"study_item\": [\n        {\n          \"topic\": \"Laminar vs Turbulent Flow\",\n          \"description\": \"Compare laminar vs turbulent flow (Section 6.3).\",\n          \"duration_minutes\": 45,\n          \"resource\": [\n            {\n              \"title\": \"Convection Heat Transfer Textbook\",\n              \"type\": \"textbook\",\n              \"url\": null,\n              \"description\": \"Section 6.3\"\n            }\n          ],\n          \"is_completed\": false,\n          \"learning_objectives\": [\n            \"Differentiate between laminar and turbulent flow.\",\n            \"Understand their characteristics.\"\n          ],\n          \"priority\": \"high\"\n        },\n        {\n          \"topic\": \"Transition Criteria\",\n          \"description\": \"Analyze transition criteria and Reynolds number.\",\n          \"duration_minutes\": 45,\n          \"resource\": [\n            {\n              \"title\": \"Convection Heat Transfer Textbook\",\n              \"type\": \"textbook\",\n              \"url\": null,\n              \"description\": \"Section 6.3\"\n            }\n          ],\n          \"is_completed\": false,\n          \"learning_objectives\": [\n            \"Understand the transition from laminar to turbulent flow.\",\n            \"Calculate and interpret Reynolds number.\"\n          ],\n          \"priority\": \"high\"\n        },\n        {\n          \"topic\": \"Flow Regime Effects\",\n          \"description\": \"Work through Example 6.4 on flow regime effects.\",\n          \"duration_minutes\": 30,\n          \"resource\": [\n            {\n              \"title\": \"Convection Heat Transfer Textbook\",\n              \"type\": \"textbook\",\n              \"url\": null,\n              \"description\": \"Example 6.4\"\n            }\n          ],\n          \"is_completed\": false,\n          \"learning_objectives\": [\n            \"Analyze the impact of flow regime on heat transfer.\",\n            \"Apply Reynolds number to practical problems.\"\n          ],\n          \"priority\": \"high\"\n        }\n      ],\n      \"summary\": \"Compared laminar and turbulent flow, analyzed transition criteria using Reynolds number, and examined the effects of flow regime on heat transfer.\",\n      \"learning_goals\": [\n        \"Understand flow regimes.\",\n        \"Analyze transition criteria.\"\n      ],\n      \"review_topics\": [\n        \"Convection Coefficients\"\n      ]\n    },\n    {\n      \"day\": 4,\n      \"date\": null,\n      \"focus_area\": \"Governing Equations\",\n      \"study_item\": [\n        {\n          \"topic\": \"Boundary Layer Equations\",\n          \"description\": \"Study simplified boundary layer equations (6.27-6.30).\",\n          \"duration_minutes\": 60,\n          \"resource\": [\n            {\n              \"title\": \"Convection Heat Transfer Textbook\",\n              \"type\": \"textbook\",\n              \"url\": null,\n              \"description\": \"Equations 6.27-6.30\"\n            }\n          ],\n          \"is_completed\": false,\n          \"learning_objectives\": [\n            \"Understand the simplified boundary layer equations.\",\n            \"Analyze their derivation and significance.\"\n          ],\n          \"priority\": \"high\"\n        },\n        {\n          \"topic\": \"Assumptions and Limitations\",\n          \"description\": \"Examine assumptions and limitations of boundary layer equations.\",\n          \"duration_minutes\": 30,\n          \"resource\": [\n            {\n              \"title\": \"Convection Heat Transfer Textbook\",\n              \"type\": \"textbook\",\n              \"url\": null,\n              \"description\": \"Section 6.4\"\n            }\n          ],\n          \"is_completed\": false,\n          \"learning_objectives\": [\n            \"Understand the assumptions behind boundary layer equations.\",\n            \"Recognize their limitations.\"\n          ],\n          \"priority\": \"high\"\n        },\n        {\n          \"topic\": \"Momentum/Energy Equations\",\n          \"description\": \"Solve problems involving momentum/energy equations.\",\n          \"duration_minutes\": 30,\n          \"resource\": [\n            {\n              \"title\": \"Convection Heat Transfer Textbook\",\n              \"type\": \"textbook\",\n              \"url\": null,\n              \"description\": \"Practice Problems\"\n            }\n          ],\n          \"is_completed\": false,\n          \"learning_objectives\": [\n            \"Apply boundary layer equations to solve problems.\",\n            \"Integrate momentum and energy equations.\"\n          ],\n          \"priority\": \"high\"\n        }\n      ],\n      \"summary\": \"Studied the simplified boundary layer equations, examined their assumptions and limitations, and solved problems involving momentum and energy equations.\",\n      \"learning_goals\": [\n        \"Understand boundary layer equations.\",\n        \"Apply momentum and energy equations.\"\n      ],\n      \"review_topics\": [\n        \"Flow Regimes\"\n      ]\n    },\n    {\n      \"day\": 5,\n      \"date\": null,\n      \"focus_area\": \"Dimensionless Analysis\",\n      \"study_item\": [\n        {\n          \"topic\": \"Similarity Parameters\",\n          \"description\": \"Learn similarity parameters (Re, Pr, Sc, Nu, Sh).\",\n          \"duration_minutes\": 45,\n          \"resource\": [\n            {\n              \"title\": \"Convection Heat Transfer Textbook\",\n              \"type\": \"textbook\",\n              \"url\": null,\n              \"description\": \"Section 6.5\"\n            }\n          ],\n          \"is_completed\": false,\n          \"learning_objectives\": [\n            \"Understand key dimensionless numbers.\",\n            \"Interpret their physical significance.\"\n          ],\n          \"priority\": \"high\"\n        },\n        {\n          \"topic\": \"Normalized Equations\",\n          \"description\": \"Study normalized equations (Table 6.1).\",\n          \"duration_minutes\": 45,\n          \"resource\": [\n            {\n              \"title\": \"Convection Heat Transfer Textbook\",\n              \"type\": \"textbook\",\n              \"url\": null,\n              \"description\": \"Table 6.1\"\n            }\n          ],\n          \"is_completed\": false,\n          \"learning_objectives\": [\n            \"Analyze normalized boundary layer equations.\",\n            \"Understand the role of dimensionless numbers.\"\n          ],\n          \"priority\": \"high\"\n        },\n        {\n          \"topic\": \"Dimensionless Groups\",\n          \"description\": \"Work through Example 6.5 on dimensionless groups.\",\n          \"duration_minutes\": 30,\n          \"resource\": [\n            {\n              \"title\": \"Convection Heat Transfer Textbook\",\n              \"type\": \"textbook\",\n              \"url\": null,\n              \"description\": \"Example 6.5\"\n            }\n          ],\n          \"is_completed\": false,\n          \"learning_objectives\": [\n            \"Apply dimensionless analysis to solve problems.\",\n            \"Interpret results in terms of dimensionless groups.\"\n          ],\n          \"priority\": \"high\"\n        }\n      ],\n      \"summary\": \"Learned about key dimensionless numbers, studied normalized boundary layer equations, and applied dimensionless analysis to solve problems.\",\n      \"learning_goals\": [\n        \"Understand dimensionless analysis.\",\n        \"Apply similarity parameters.\"\n      ],\n      \"review_topics\": [\n        \"Governing Equations\"\n      ]\n    },\n    {\n      \"day\": 6,\n      \"date\": null,\n      \"focus_area\": \"Analogies\",\n      \"study_item\": [\n        {\n          \"topic\": \"Heat-Mass Transfer Analogy\",\n          \"description\": \"Study heat-mass transfer analogy (Section 6.7.1).\",\n          \"duration_minutes\": 60,\n          \"resource\": [\n            {\n              \"title\": \"Convection Heat Transfer Textbook\",\n              \"type\": \"textbook\",\n              \"url\": null,\n              \"description\": \"Section 6.7.1\"\n            }\n          ],\n          \"is_completed\": false,\n          \"learning_objectives\": [\n            \"Understand the analogy between heat and mass transfer.\",\n            \"Analyze the governing equations.\"\n          ],\n          \"priority\": \"high\"\n        },\n        {\n          \"topic\": \"Reynolds Analogy\",\n          \"description\": \"Analyze Reynolds analogy (Equations 6.66-6.69).\",\n          \"duration_minutes\": 30,\n          \"resource\": [\n            {\n              \"title\": \"Convection Heat Transfer Textbook\",\n              \"type\": \"textbook\",\n              \"url\": null,\n              \"description\": \"Equations 6.66-6.69\"\n            }\n          ],\n          \"is_completed\": false,\n          \"learning_objectives\": [\n            \"Understand the Reynolds analogy.\",\n            \"Apply it to solve problems.\"\n          ],\n          \"priority\": \"high\"\n        },\n        {\n          \"topic\": \"Practical Applications\",\n          \"description\": \"Solve Example 6.7 on practical applications.\",\n          \"duration_minutes\": 30,\n          \"resource\": [\n            {\n              \"title\": \"Convection Heat Transfer Textbook\",\n              \"type\": \"textbook\",\n              \"url\": null,\n              \"description\": \"Example 6.7\"\n            }\n          ],\n          \"is_completed\": false,\n          \"learning_objectives\": [\n            \"Apply analogies to practical problems.\",\n            \"Integrate heat and mass",
  "error": {
    "error": "Failed to validate structured plan",
    "details": "10 validation errors for StructuredStudyPlan\nkey_formulas.0.formula\n  Field required [type=missing, input_value={'name': 'Boundary Layer ...ficulty_level': 'basic'}, input_type=dict]\n    For further information visit https://errors.pydantic.dev/2.11/v/missing\nkey_formulas.0.description\n  Field required [type=missing, input_value={'name': 'Boundary Layer ...ficulty_level': 'basic'}, input_type=dict]\n    For further information visit https://errors.pydantic.dev/2.11/v/missing\nkey_formulas.1.formula\n  Field required [type=missing, input_value={'name': 'Convection Coef...ficulty_level': 'basic'}, input_type=dict]\n    For further information visit https://errors.pydantic.dev/2.11/v/missing\nkey_formulas.1.description\n  Field required [type=missing, input_value={'name': 'Convection Coef...ficulty_level': 'basic'}, input_type=dict]\n    For further information visit https://errors.pydantic.dev/2.11/v/missing\nkey_formulas.2.formula\n  Field required [type=missing, input_value={'name': 'Flow Regimes', ...ficulty_level': 'basic'}, input_type=dict]\n    For further information visit https://errors.pydantic.dev/2.11/v/missing\nkey_formulas.2.description\n  Field required [type=missing, input_value={'name': 'Flow Regimes', ...ficulty_level': 'basic'}, input_type=dict]\n    For further information visit https://errors.pydantic.dev/2.11/v/missing\nkey_formulas.3.formula\n  Field required [type=missing, input_value={'name': 'Boundary Layer ..._level': 'intermediate'}, input_type=dict]\n    For further information visit https://errors.pydantic.dev/2.11/v/missing\nkey_formulas.3.description\n  Field required [type=missing, input_value={'name': 'Boundary Layer ..._level': 'intermediate'}, input_type=dict]\n    For further information visit https://errors.pydantic.dev/2.11/v/missing\nkey_formulas.4.formula\n  Field required [type=missing, input_value={'name': 'Dimensionless N..._level': 'intermediate'}, input_type=dict]\n    For further information visit https://errors.pydantic.dev/2.11/v/missing\nkey_formulas.4.description\n  Field required [type=missing, input_value={'name': 'Dimensionless N..._level': 'intermediate'}, input_type=dict]\n    For further information visit https://errors.pydantic.dev/2.11/v/missing",
    "parsed_json": {
      "overall_goal": "Master the fundamentals of convection heat transfer, focusing on boundary layers, dimensionless parameters, governing equations, and practical applications.",
      "total_study_day": 7,
      "hour_per_day": 2.0,
      "core_concepts": [
        {
          "name": "Boundary layer development",
          "explanation": "Understanding the development of velocity, thermal, and concentration boundary layers in fluid flow over surfaces.",
          "importance": "Fundamental to analyzing heat and mass transfer in convective systems.",
          "related_concepts": [
            "Velocity boundary layer",
            "Thermal boundary layer"
          ],
          "examples": [
            "Heat transfer over a flat plate",
            "Cooling of electronic components"
          ],
          "difficulty_level": "intermediate"
        },
        {
          "name": "Local vs average convection coefficients",
          "explanation": "Distinction between point-specific and surface-averaged heat/mass transfer coefficients.",
          "importance": "Crucial for accurate calculation of overall heat transfer rates.",
          "related_concepts": [
            "Nusselt number",
            "Heat transfer rate calculations"
          ],
          "examples": [
            "Calculating heat loss from a pipe",
            "Determining cooling rates for industrial processes"
          ],
          "difficulty_level": "intermediate"
        },
        {
          "name": "Laminar vs turbulent flow characteristics",
          "explanation": "Comparison of flow regimes and their impact on heat transfer mechanisms.",
          "importance": "Determines the mathematical approach and correlations needed for analysis.",
          "related_concepts": [
            "Reynolds number",
            "Transition criteria"
          ],
          "examples": [
            "Flow over aircraft wings",
            "Heat exchanger design"
          ],
          "difficulty_level": "basic"
        },
        {
          "name": "Boundary layer equations",
          "explanation": "Simplified governing equations for momentum, energy and mass transfer in boundary layers.",
          "importance": "Foundation for analytical solutions to convection problems.",
          "related_concepts": [
            "Navier-Stokes equations",
            "Similarity solutions"
          ],
          "examples": [
            "Flat plate heat transfer analysis",
            "Pipe flow calculations"
          ],
          "difficulty_level": "advanced"
        },
        {
          "name": "Heat and mass transfer analogies",
          "explanation": "Relationships between different transfer processes based on dimensionless parameters.",
          "importance": "Allows prediction of one transfer process from knowledge of another.",
          "related_concepts": [
            "Reynolds analogy",
            "Chilton-Colburn analogy"
          ],
          "examples": [
            "Evaporative cooling systems",
            "Mass transfer in chemical reactors"
          ],
          "difficulty_level": "intermediate"
        }
      ],
      "general_tip": [
        "Create concept maps to visualize relationships between parameters",
        "Use color-coding for different boundary layer types",
        "Practice deriving key equations from first principles",
        "Work problems both analytically and numerically",
        "Relate concepts to real-world examples",
        "Review daily with spaced repetition technique",
        "Form study groups to explain concepts to peers"
      ],
      "daily_schedule": [
        {
          "day": 1,
          "focus_area": "Boundary Layer Fundamentals",
          "study_item": [
            {
              "topic": "Boundary Layer Concept",
              "description": "Read and summarize Section 6.1 on boundary layer concepts",
              "duration_minutes": 30
            },
            {
              "topic": "Velocity Boundary Layer",
              "description": "Study velocity boundary layer development (Equations 6.1-6.2)",
              "duration_minutes": 30
            },
            {
              "topic": "Thermal Boundary Layer",
              "description": "Analyze thermal boundary layer formation (Equations 6.3-6.5)",
              "duration_minutes": 30
            },
            {
              "topic": "Heat Transfer Coefficients",
              "description": "Work through Example 6.1 on heat transfer coefficients",
              "duration_minutes": 30
            }
          ],
          "summary": "Learned the fundamentals of boundary layers, including velocity and thermal boundary layers, and their role in heat transfer.",
          "learning_goals": [
            "Understand boundary layer development",
            "Grasp the concept of heat transfer coefficients"
          ],
          "review_topics": []
        },
        {
          "day": 2,
          "focus_area": "Convection Coefficients",
          "study_item": [
            {
              "topic": "Local vs Average Coefficients",
              "description": "Review local vs average coefficients (Section 6.2)",
              "duration_minutes": 30
            },
            {
              "topic": "Mass Transfer Analogies",
              "description": "Study mass transfer analogies (Equations 6.6-6.9)",
              "duration_minutes": 30
            },
            {
              "topic": "Mass Transfer Application",
              "description": "Solve Example 6.2 on mass transfer applications",
              "duration_minutes": 30
            },
            {
              "topic": "Concentration Boundary Layer",
              "description": "Practice problems on concentration boundary layers",
              "duration_minutes": 30
            }
          ],
          "summary": "Explored convection coefficients, mass transfer analogies, and their applications in boundary layers.",
          "learning_goals": [
            "Differentiate between local and average coefficients",
            "Apply mass transfer analogies to boundary layers"
          ],
          "review_topics": [
            "Boundary Layer Fundamentals"
          ]
        },
        {
          "day": 3,
          "focus_area": "Flow Regimes",
          "study_item": [
            {
              "topic": "Laminar vs Turbulent Flow",
              "description": "Compare laminar vs turbulent flow (Section 6.3)",
              "duration_minutes": 45
            },
            {
              "topic": "Transition Criteria",
              "description": "Analyze transition criteria and Reynolds number",
              "duration_minutes": 45
            },
            {
              "topic": "Flow Regime Effects",
              "description": "Work through Example 6.4 on flow regime effects",
              "duration_minutes": 30
            }
          ],
          "summary": "Studied the differences between laminar and turbulent flow, transition criteria, and their impact on boundary layers.",
          "learning_goals": [
            "Understand flow regime characteristics",
            "Analyze transition criteria"
          ],
          "review_topics": [
            "Convection Coefficients"
          ]
        },
        {
          "day": 4,
          "focus_area": "Governing Equations",
          "study_item": [
            {
              "topic": "Boundary Layer Equations",
              "description": "Study simplified boundary layer equations (6.27-6.30)",
              "duration_minutes": 60
            },
            {
              "topic": "Assumptions and Limitations",
              "description": "Examine assumptions and limitations of boundary layer equations",
              "duration_minutes": 30
            },
            {
              "topic": "Momentum/Energy Equations",
              "description": "Solve problems involving momentum/energy equations",
              "duration_minutes": 30
            }
          ],
          "summary": "Learned the governing equations for boundary layers, their assumptions, and applications in solving momentum and energy problems.",
          "learning_goals": [
            "Master boundary layer equations",
            "Understand assumptions and limitations"
          ],
          "review_topics": [
            "Flow Regimes"
          ]
        },
        {
          "day": 5,
          "focus_area": "Dimensionless Analysis",
          "study_item": [
            {
              "topic": "Similarity Parameters",
              "description": "Learn similarity parameters (Re, Pr, Sc, Nu, Sh)",
              "duration_minutes": 45
            },
            {
              "topic": "Normalized Equations",
              "description": "Study normalized equations (Table 6.1)",
              "duration_minutes": 45
            },
            {
              "topic": "Dimensionless Groups",
              "description": "Work through Example 6.5 on dimensionless groups",
              "duration_minutes": 30
            }
          ],
          "summary": "Explored dimensionless analysis, similarity parameters, and their role in boundary layer problems.",
          "learning_goals": [
            "Understand dimensionless groups",
            "Apply similarity parameters"
          ],
          "review_topics": [
            "Governing Equations"
          ]
        },
        {
          "day": 6,
          "focus_area": "Analogies",
          "study_item": [
            {
              "topic": "Heat-Mass Transfer Analogy",
              "description": "Study heat-mass transfer analogy (Section 6.7.1)",
              "duration_minutes": 60
            },
            {
              "topic": "Reynolds Analogy",
              "description": "Analyze Reynolds analogy (Equations 6.66-6.69)",
              "duration_minutes": 30
            },
            {
              "topic": "Practical Applications",
              "description": "Solve Example 6.7 on practical applications",
              "duration_minutes": 30
            }
          ],
          "summary": "Learned heat-mass transfer analogies, Reynolds analogy, and their practical applications.",
          "learning_goals": [
            "Understand heat-mass transfer analogies",
            "Apply Reynolds analogy"
          ],
          "review_topics": [
            "Dimensionless Analysis"
          ]
        },
        {
          "day": 7,
          "focus_area": "Applications & Review",
          "study_item": [
            {
              "topic": "Evaporative Cooling",
              "description": "Study evaporative cooling (Example 6.8)",
              "duration_minutes": 60
            },
            {
              "topic": "Key Concepts Review",
              "description": "Review all key concepts",
              "duration_minutes": 30
            },
            {
              "topic": "Practice Problems",
              "description": "Complete practice problems from chapter",
              "duration_minutes": 30
            }
          ],
          "summary": "Reviewed key concepts, studied evaporative cooling, and practiced problems to reinforce learning.",
          "learning_goals": [
            "Apply concepts to practical problems",
            "Reinforce understanding of boundary layers"
          ],
          "review_topics": [
            "Analogies"
          ]
        }
      ],
      "key_formulas": [
        {
          "name": "Boundary Layer Development",
          "explanation": "The boundary layer is the region near a surface where the velocity, temperature, or concentration of a fluid changes from the free stream value to the surface value. It includes velocity, thermal, and concentration boundary layers.",
          "importance": "Understanding boundary layers is crucial for analyzing heat and mass transfer in fluid flows, as it determines the resistance to heat and mass transfer.",
          "related_concepts": [
            "Velocity Boundary Layer",
            "Thermal Boundary Layer",
            "Concentration Boundary Layer"
          ],
          "example": [
            "Velocity boundary layer on an airplane wing affects drag and lift.",
            "Thermal boundary layer in a heat exchanger affects heat transfer efficiency."
          ],
          "difficulty_level": "basic"
        },
        {
          "name": "Convection Coefficients",
          "explanation": "Convection coefficients quantify the rate of heat or mass transfer between a surface and a fluid. They can be local or average, depending on the spatial variation.",
          "importance": "These coefficients are essential for designing thermal systems like heat exchangers and cooling systems.",
          "related_concepts": [
            "Local Convection Coefficient",
            "Average Convection Coefficient",
            "Mass Transfer Coefficient"
          ],
          "example": [
            "Calculating the heat transfer coefficient for a radiator.",
            "Determining the mass transfer coefficient in a chemical reactor."
          ],
          "difficulty_level": "basic"
        },
        {
          "name": "Flow Regimes",
          "explanation": "Flow can be laminar (smooth and orderly) or turbulent (chaotic and irregular). The transition between these regimes is determined by the Reynolds number.",
          "importance": "Different flow regimes have significantly different heat and mass transfer characteristics, affecting system performance.",
          "related_concepts": [
            "Laminar Flow",
            "Turbulent Flow",
            "Reynolds Number"
          ],
          "example": [
            "Laminar flow in a pipe results in lower heat transfer compared to turbulent flow.",
            "Turbulent flow enhances mixing in chemical reactors."
          ],
          "difficulty_level": "basic"
        },
        {
          "name": "Boundary Layer Equations",
          "explanation": "Simplified equations derived from the Navier-Stokes equations that describe the behavior of boundary layers under certain assumptions.",
          "importance": "These equations allow for analytical and numerical solutions to boundary layer problems, simplifying complex fluid dynamics.",
          "related_concepts": [
            "Momentum Equation",
            "Energy Equation",
            "Continuity Equation"
          ],
          "example": [
            "Solving the boundary layer equations to find velocity profile over a flat plate.",
            "Using the energy equation to determine temperature distribution in a thermal boundary layer."
          ],
          "difficulty_level": "intermediate"
        },
        {
          "name": "Dimensionless Numbers",
          "explanation": "Dimensionless groups like Reynolds, Prandtl, and Nusselt numbers characterize fluid flow and heat transfer phenomena.",
          "importance": "These numbers simplify the analysis of complex systems by reducing the number of variables and scaling effects.",
          "related_concepts": [
            "Reynolds Number",
            "Prandtl Number",
            "Nusselt Number"
          ],
          "example": [
            "Using the Reynolds number to predict flow regime in a pipe.",
            "Prandtl number indicates the relative thickness of velocity and thermal boundary layers."
          ],
          "difficulty_level": "intermediate"
        }
      ]
    },
    "raw_response": "CORE:\n```json\n{\n  \"overall_goal\": \"Master the fundamentals of convection heat transfer, focusing on boundary layers, dimensionless parameters, governing equations, and practical applications.\",\n  \"total_study_day\": \"7\",\n  \"hour_per_day\": \"2.0\",\n  \"core_concepts\": [\n    {\n      \"name\": \"Boundary layer development\",\n      \"explanation\": \"Understanding the development of velocity, thermal, and concentration boundary layers in fluid flow over surfaces.\",\n      \"importance\": \"Fundamental to analyzing heat and mass transfer in convective systems.\",\n      \"related_concepts\": [\n        \"Velocity boundary layer\",\n        \"Thermal boundary layer\"\n      ],\n      \"examples\": [\n        \"Heat transfer over a flat plate\",\n        \"Cooling of electronic components\"\n      ],\n      \"difficulty_level\": \"intermediate\"\n    },\n    {\n      \"name\": \"Local vs average convection coefficients\",\n      \"explanation\": \"Distinction between point-specific and surface-averaged heat/mass transfer coefficients.\",\n      \"importance\": \"Crucial for accurate calculation of overall heat transfer rates.\",\n      \"related_concepts\": [\n        \"Nusselt number\",\n        \"Heat transfer rate calculations\"\n      ],\n      \"examples\": [\n        \"Calculating heat loss from a pipe\",\n        \"Determining cooling rates for industrial processes\"\n      ],\n      \"difficulty_level\": \"intermediate\"\n    },\n    {\n      \"name\": \"Laminar vs turbulent flow characteristics\",\n      \"explanation\": \"Comparison of flow regimes and their impact on heat transfer mechanisms.\",\n      \"importance\": \"Determines the mathematical approach and correlations needed for analysis.\",\n      \"related_concepts\": [\n        \"Reynolds number\",\n        \"Transition criteria\"\n      ],\n      \"examples\": [\n        \"Flow over aircraft wings\",\n        \"Heat exchanger design\"\n      ],\n      \"difficulty_level\": \"basic\"\n    },\n    {\n      \"name\": \"Boundary layer equations\",\n      \"explanation\": \"Simplified governing equations for momentum, energy and mass transfer in boundary layers.\",\n      \"importance\": \"Foundation for analytical solutions to convection problems.\",\n      \"related_concepts\": [\n        \"Navier-Stokes equations\",\n        \"Similarity solutions\"\n      ],\n      \"examples\": [\n        \"Flat plate heat transfer analysis\",\n        \"Pipe flow calculations\"\n      ],\n      \"difficulty_level\": \"advanced\"\n    },\n    {\n      \"name\": \"Heat and mass transfer analogies\",\n      \"explanation\": \"Relationships between different transfer processes based on dimensionless parameters.\",\n      \"importance\": \"Allows prediction of one transfer process from knowledge of another.\",\n      \"related_concepts\": [\n        \"Reynolds analogy\",\n        \"Chilton-Colburn analogy\"\n      ],\n      \"examples\": [\n        \"Evaporative cooling systems\",\n        \"Mass transfer in chemical reactors\"\n      ],\n      \"difficulty_level\": \"intermediate\"\n    }\n  ],\n  \"general_tip\": [\n    \"Create concept maps to visualize relationships between parameters\",\n    \"Use color-coding for different boundary layer types\",\n    \"Practice deriving key equations from first principles\",\n    \"Work problems both analytically and numerically\",\n    \"Relate concepts to real-world examples\",\n    \"Review daily with spaced repetition technique\",\n    \"Form study groups to explain concepts to peers\"\n  ]\n}\n```\n\nSCHEDULE:\n            {\n  \"daily_schedule\": [\n    {\n      \"day\": 1,\n      \"focus_area\": \"Boundary Layer Fundamentals\",\n      \"study_item\": [\n        {\n          \"topic\": \"Boundary Layer Concept\",\n          \"description\": \"Read and summarize Section 6.1 on boundary layer concepts\",\n          \"duration_minutes\": 30\n        },\n        {\n          \"topic\": \"Velocity Boundary Layer\",\n          \"description\": \"Study velocity boundary layer development (Equations 6.1-6.2)\",\n          \"duration_minutes\": 30\n        },\n        {\n          \"topic\": \"Thermal Boundary Layer\",\n          \"description\": \"Analyze thermal boundary layer formation (Equations 6.3-6.5)\",\n          \"duration_minutes\": 30\n        },\n        {\n          \"topic\": \"Heat Transfer Coefficients\",\n          \"description\": \"Work through Example 6.1 on heat transfer coefficients\",\n          \"duration_minutes\": 30\n        }\n      ],\n      \"summary\": \"Learned the fundamentals of boundary layers, including velocity and thermal boundary layers, and their role in heat transfer.\",\n      \"learning_goals\": [\n        \"Understand boundary layer development\",\n        \"Grasp the concept of heat transfer coefficients\"\n      ],\n      \"review_topics\": []\n    },\n    {\n      \"day\": 2,\n      \"focus_area\": \"Convection Coefficients\",\n      \"study_item\": [\n        {\n          \"topic\": \"Local vs Average Coefficients\",\n          \"description\": \"Review local vs average coefficients (Section 6.2)\",\n          \"duration_minutes\": 30\n        },\n        {\n          \"topic\": \"Mass Transfer Analogies\",\n          \"description\": \"Study mass transfer analogies (Equations 6.6-6.9)\",\n          \"duration_minutes\": 30\n        },\n        {\n          \"topic\": \"Mass Transfer Application\",\n          \"description\": \"Solve Example 6.2 on mass transfer applications\",\n          \"duration_minutes\": 30\n        },\n        {\n          \"topic\": \"Concentration Boundary Layer\",\n          \"description\": \"Practice problems on concentration boundary layers\",\n          \"duration_minutes\": 30\n        }\n      ],\n      \"summary\": \"Explored convection coefficients, mass transfer analogies, and their applications in boundary layers.\",\n      \"learning_goals\": [\n        \"Differentiate between local and average coefficients\",\n        \"Apply mass transfer analogies to boundary layers\"\n      ],\n      \"review_topics\": [\n        \"Boundary Layer Fundamentals\"\n      ]\n    },\n    {\n      \"day\": 3,\n      \"focus_area\": \"Flow Regimes\",\n      \"study_item\": [\n        {\n          \"topic\": \"Laminar vs Turbulent Flow\",\n          \"description\": \"Compare laminar vs turbulent flow (Section 6.3)\",\n          \"duration_minutes\": 45\n        },\n        {\n          \"topic\": \"Transition Criteria\",\n          \"description\": \"Analyze transition criteria and Reynolds number\",\n          \"duration_minutes\": 45\n        },\n        {\n          \"topic\": \"Flow Regime Effects\",\n          \"description\": \"Work through Example 6.4 on flow regime effects\",\n          \"duration_minutes\": 30\n        }\n      ],\n      \"summary\": \"Studied the differences between laminar and turbulent flow, transition criteria, and their impact on boundary layers.\",\n      \"learning_goals\": [\n        \"Understand flow regime characteristics\",\n        \"Analyze transition criteria\"\n      ],\n      \"review_topics\": [\n        \"Convection Coefficients\"\n      ]\n    },\n    {\n      \"day\": 4,\n      \"focus_area\": \"Governing Equations\",\n      \"study_item\": [\n        {\n          \"topic\": \"Boundary Layer Equations\",\n          \"description\": \"Study simplified boundary layer equations (6.27-6.30)\",\n          \"duration_minutes\": 60\n        },\n        {\n          \"topic\": \"Assumptions and Limitations\",\n          \"description\": \"Examine assumptions and limitations of boundary layer equations\",\n          \"duration_minutes\": 30\n        },\n        {\n          \"topic\": \"Momentum/Energy Equations\",\n          \"description\": \"Solve problems involving momentum/energy equations\",\n          \"duration_minutes\": 30\n        }\n      ],\n      \"summary\": \"Learned the governing equations for boundary layers, their assumptions, and applications in solving momentum and energy problems.\",\n      \"learning_goals\": [\n        \"Master boundary layer equations\",\n        \"Understand assumptions and limitations\"\n      ],\n      \"review_topics\": [\n        \"Flow Regimes\"\n      ]\n    },\n    {\n      \"day\": 5,\n      \"focus_area\": \"Dimensionless Analysis\",\n      \"study_item\": [\n        {\n          \"topic\": \"Similarity Parameters\",\n          \"description\": \"Learn similarity parameters (Re, Pr, Sc, Nu, Sh)\",\n          \"duration_minutes\": 45\n        },\n        {\n          \"topic\": \"Normalized Equations\",\n          \"description\": \"Study normalized equations (Table 6.1)\",\n          \"duration_minutes\": 45\n        },\n        {\n          \"topic\": \"Dimensionless Groups\",\n          \"description\": \"Work through Example 6.5 on dimensionless groups\",\n          \"duration_minutes\": 30\n        }\n      ],\n      \"summary\": \"Explored dimensionless analysis, similarity parameters, and their role in boundary layer problems.\",\n      \"learning_goals\": [\n        \"Understand dimensionless groups\",\n        \"Apply similarity parameters\"\n      ],\n      \"review_topics\": [\n        \"Governing Equations\"\n      ]\n    },\n    {\n      \"day\": 6,\n      \"focus_area\": \"Analogies\",\n      \"study_item\": [\n        {\n          \"topic\": \"Heat-Mass Transfer Analogy\",\n          \"description\": \"Study heat-mass transfer analogy (Section 6.7.1)\",\n          \"duration_minutes\": 60\n        },\n        {\n          \"topic\": \"Reynolds Analogy\",\n          \"description\": \"Analyze Reynolds analogy (Equations 6.66-6.69)\",\n          \"duration_minutes\": 30\n        },\n        {\n          \"topic\": \"Practical Applications\",\n          \"description\": \"Solve Example 6.7 on practical applications\",\n          \"duration_minutes\": 30\n        }\n      ],\n      \"summary\": \"Learned heat-mass transfer analogies, Reynolds analogy, and their practical applications.\",\n      \"learning_goals\": [\n        \"Understand heat-mass transfer analogies\",\n        \"Apply Reynolds analogy\"\n      ],\n      \"review_topics\": [\n        \"Dimensionless Analysis\"\n      ]\n    },\n    {\n      \"day\": 7,\n      \"focus_area\": \"Applications & Review\",\n      \"study_item\": [\n        {\n          \"topic\": \"Evaporative Cooling\",\n          \"description\": \"Study evaporative cooling (Example 6.8)\",\n          \"duration_minutes\": 60\n        },\n        {\n          \"topic\": \"Key Concepts Review\",\n          \"description\": \"Review all key concepts\",\n          \"duration_minutes\": 30\n        },\n        {\n          \"topic\": \"Practice Problems\",\n          \"description\": \"Complete practice problems from chapter\",\n          \"duration_minutes\": 30\n        }\n      ],\n      \"summary\": \"Reviewed key concepts, studied evaporative cooling, and practiced problems to reinforce learning.\",\n      \"learning_goals\": [\n        \"Apply concepts to practical problems\",\n        \"Reinforce understanding of boundary layers\"\n      ],\n      \"review_topics\": [\n        \"Analogies\"\n      ]\n    }\n  ]\n}\n\nFORMULAS:\n```json\n{\n  \"overall_goal\": \"Master the fundamental concept of Convection Heat Transfer, focusing on Boundary Layer Development, Convection Coefficients, and Flow Regimes.\",\n  \"total_study_day\": \"7\",\n  \"hour_per_day\": \"2.0\",\n  \"core_concepts\": [\n    {\n      \"name\": \"Boundary Layer Development\",\n      \"explanation\": \"The boundary layer is the region near a surface where the velocity, temperature, or concentration of a fluid changes from the free stream value to the surface value. It includes velocity, thermal, and concentration boundary layers.\",\n      \"importance\": \"Understanding boundary layers is crucial for analyzing heat and mass transfer in fluid flows, as it determines the resistance to heat and mass transfer.\",\n      \"related_concepts\": [\n        \"Velocity Boundary Layer\",\n        \"Thermal Boundary Layer\",\n        \"Concentration Boundary Layer\"\n      ],\n      \"example\": [\n        \"Velocity boundary layer on an airplane wing affects drag and lift.\",\n        \"Thermal boundary layer in a heat exchanger affects heat transfer efficiency.\"\n      ],\n      \"difficulty_level\": \"basic\"\n    },\n    {\n      \"name\": \"Convection Coefficients\",\n      \"explanation\": \"Convection coefficients quantify the rate of heat or mass transfer between a surface and a fluid. They can be local or average, depending on the spatial variation.\",\n      \"importance\": \"These coefficients are essential for designing thermal systems like heat exchangers and cooling systems.\",\n      \"related_concepts\": [\n        \"Local Convection Coefficient\",\n        \"Average Convection Coefficient\",\n        \"Mass Transfer Coefficient\"\n      ],\n      \"example\": [\n        \"Calculating the heat transfer coefficient for a radiator.\",\n        \"Determining the mass transfer coefficient in a chemical reactor.\"\n      ],\n      \"difficulty_level\": \"basic\"\n    },\n    {\n      \"name\": \"Flow Regimes\",\n      \"explanation\": \"Flow can be laminar (smooth and orderly) or turbulent (chaotic and irregular). The transition between these regimes is determined by the Reynolds number.\",\n      \"importance\": \"Different flow regimes have significantly different heat and mass transfer characteristics, affecting system performance.\",\n      \"related_concepts\": [\n        \"Laminar Flow\",\n        \"Turbulent Flow\",\n        \"Reynolds Number\"\n      ],\n      \"example\": [\n        \"Laminar flow in a pipe results in lower heat transfer compared to turbulent flow.\",\n        \"Turbulent flow enhances mixing in chemical reactors.\"\n      ],\n      \"difficulty_level\": \"basic\"\n    },\n    {\n      \"name\": \"Boundary Layer Equations\",\n      \"explanation\": \"Simplified equations derived from the Navier-Stokes equations that describe the behavior of boundary layers under certain assumptions.\",\n      \"importance\": \"These equations allow for analytical and numerical solutions to boundary layer problems, simplifying complex fluid dynamics.\",\n      \"related_concepts\": [\n        \"Momentum Equation\",\n        \"Energy Equation\",\n        \"Continuity Equation\"\n      ],\n      \"example\": [\n        \"Solving the boundary layer equations to find velocity profile over a flat plate.\",\n        \"Using the energy equation to determine temperature distribution in a thermal boundary layer.\"\n      ],\n      \"difficulty_level\": \"intermediate\"\n    },\n    {\n      \"name\": \"Dimensionless Numbers\",\n      \"explanation\": \"Dimensionless groups like Reynolds, Prandtl, and Nusselt numbers characterize fluid flow and heat transfer phenomena.\",\n      \"importance\": \"These numbers simplify the analysis of complex systems by reducing the number of variables and scaling effects.\",\n      \"related_concepts\": [\n        \"Reynolds Number\",\n        \"Prandtl Number\",\n        \"Nusselt Number\"\n      ],\n      \"example\": [\n        \"Using the Reynolds number to predict flow regime in a pipe.\",\n        \"Prandtl number indicates the relative thickness of velocity and thermal boundary layers.\"\n      ],\n      \"difficulty_level\": \"intermediate\"\n    }\n  ],\n  \"daily_schedule\": [\n    {\n      \"day\": 1,\n      \"date\": null,\n      \"focus_area\": \"Boundary Layer Fundamentals\",\n      \"study_item\": [\n        {\n          \"topic\": \"Boundary Layer Concept\",\n          \"description\": \"Read and summarize Section 6.1 on boundary layer concepts.\",\n          \"duration_minutes\": 30,\n          \"resource\": [\n            {\n              \"title\": \"Convection Heat Transfer Textbook\",\n              \"type\": \"textbook\",\n              \"url\": null,\n              \"description\": \"Chapter 6, Section 6.1\"\n            }\n          ],\n          \"is_completed\": false,\n          \"learning_objectives\": [\n            \"Understand the concept of boundary layers.\",\n            \"Differentiate between velocity, thermal, and concentration boundary layers.\"\n          ],\n          \"priority\": \"high\"\n        },\n        {\n          \"topic\": \"Velocity Boundary Layer\",\n          \"description\": \"Study velocity boundary layer development (Equations 6.1-6.2).\",\n          \"duration_minutes\": 30,\n          \"resource\": [\n            {\n              \"title\": \"Convection Heat Transfer Textbook\",\n              \"type\": \"textbook\",\n              \"url\": null,\n              \"description\": \"Equations 6.1-6.2\"\n            }\n          ],\n          \"is_completed\": false,\n          \"learning_objectives\": [\n            \"Understand the development of velocity boundary layers.\",\n            \"Analyze the governing equations for velocity boundary layers.\"\n          ],\n          \"priority\": \"high\"\n        },\n        {\n          \"topic\": \"Thermal Boundary Layer\",\n          \"description\": \"Analyze thermal boundary layer formation (Equations 6.3-6.5).\",\n          \"duration_minutes\": 30,\n          \"resource\": [\n            {\n              \"title\": \"Convection Heat Transfer Textbook\",\n              \"type\": \"textbook\",\n              \"url\": null,\n              \"description\": \"Equations 6.3-6.5\"\n            }\n          ],\n          \"is_completed\": false,\n          \"learning_objectives\": [\n            \"Understand the development of thermal boundary layers.\",\n            \"Analyze the governing equations for thermal boundary layers.\"\n          ],\n          \"priority\": \"high\"\n        },\n        {\n          \"topic\": \"Heat Transfer Coefficient\",\n          \"description\": \"Work through Example 6.1 on heat transfer coefficients.\",\n          \"duration_minutes\": 30,\n          \"resource\": [\n            {\n              \"title\": \"Convection Heat Transfer Textbook\",\n              \"type\": \"textbook\",\n              \"url\": null,\n              \"description\": \"Example 6.1\"\n            }\n          ],\n          \"is_completed\": false,\n          \"learning_objectives\": [\n            \"Calculate heat transfer coefficients.\",\n            \"Apply boundary layer concepts to practical problems.\"\n          ],\n          \"priority\": \"high\"\n        }\n      ],\n      \"summary\": \"Learned the fundamentals of boundary layers, including velocity and thermal boundary layers, and applied these concepts to calculate heat transfer coefficients.\",\n      \"learning_goals\": [\n        \"Understand boundary layer concepts.\",\n        \"Analyze velocity and thermal boundary layers.\"\n      ],\n      \"review_topics\": []\n    },\n    {\n      \"day\": 2,\n      \"date\": null,\n      \"focus_area\": \"Convection Coefficients\",\n      \"study_item\": [\n        {\n          \"topic\": \"Local vs Average Coefficients\",\n          \"description\": \"Review local vs average coefficients (Section 6.2).\",\n          \"duration_minutes\": 30,\n          \"resource\": [\n            {\n              \"title\": \"Convection Heat Transfer Textbook\",\n              \"type\": \"textbook\",\n              \"url\": null,\n              \"description\": \"Section 6.2\"\n            }\n          ],\n          \"is_completed\": false,\n          \"learning_objectives\": [\n            \"Differentiate between local and average convection coefficients.\",\n            \"Understand their significance in heat transfer.\"\n          ],\n          \"priority\": \"high\"\n        },\n        {\n          \"topic\": \"Mass Transfer Analogy\",\n          \"description\": \"Study mass transfer analogy (Equations 6.6-6.9).\",\n          \"duration_minutes\": 30,\n          \"resource\": [\n            {\n              \"title\": \"Convection Heat Transfer Textbook\",\n              \"type\": \"textbook\",\n              \"url\": null,\n              \"description\": \"Equations 6.6-6.9\"\n            }\n          ],\n          \"is_completed\": false,\n          \"learning_objectives\": [\n            \"Understand the analogy between heat and mass transfer.\",\n            \"Analyze the governing equations for mass transfer.\"\n          ],\n          \"priority\": \"high\"\n        },\n        {\n          \"topic\": \"Mass Transfer Application\",\n          \"description\": \"Solve Example 6.2 on mass transfer applications.\",\n          \"duration_minutes\": 30,\n          \"resource\": [\n            {\n              \"title\": \"Convection Heat Transfer Textbook\",\n              \"type\": \"textbook\",\n              \"url\": null,\n              \"description\": \"Example 6.2\"\n            }\n          ],\n          \"is_completed\": false,\n          \"learning_objectives\": [\n            \"Apply mass transfer concepts to practical problems.\",\n            \"Calculate mass transfer coefficients.\"\n          ],\n          \"priority\": \"high\"\n        },\n        {\n          \"topic\": \"Concentration Boundary Layer\",\n          \"description\": \"Practice problems on concentration boundary layers.\",\n          \"duration_minutes\": 30,\n          \"resource\": [\n            {\n              \"title\": \"Convection Heat Transfer Textbook\",\n              \"type\": \"textbook\",\n              \"url\": null,\n              \"description\": \"Practice Problems\"\n            }\n          ],\n          \"is_completed\": false,\n          \"learning_objectives\": [\n            \"Understand concentration boundary layers.\",\n            \"Solve problems involving mass transfer.\"\n          ],\n          \"priority\": \"high\"\n        }\n      ],\n      \"summary\": \"Reviewed local and average convection coefficients, studied mass transfer analogies, and applied these concepts to solve problems involving mass transfer and concentration boundary layers.\",\n      \"learning_goals\": [\n        \"Understand convection coefficients.\",\n        \"Apply mass transfer analogies.\"\n      ],\n      \"review_topics\": [\n        \"Boundary Layer Fundamentals\"\n      ]\n    },\n    {\n      \"day\": 3,\n      \"date\": null,\n      \"focus_area\": \"Flow Regimes\",\n      \"study_item\": [\n        {\n          \"topic\": \"Laminar vs Turbulent Flow\",\n          \"description\": \"Compare laminar vs turbulent flow (Section 6.3).\",\n          \"duration_minutes\": 45,\n          \"resource\": [\n            {\n              \"title\": \"Convection Heat Transfer Textbook\",\n              \"type\": \"textbook\",\n              \"url\": null,\n              \"description\": \"Section 6.3\"\n            }\n          ],\n          \"is_completed\": false,\n          \"learning_objectives\": [\n            \"Differentiate between laminar and turbulent flow.\",\n            \"Understand their characteristics.\"\n          ],\n          \"priority\": \"high\"\n        },\n        {\n          \"topic\": \"Transition Criteria\",\n          \"description\": \"Analyze transition criteria and Reynolds number.\",\n          \"duration_minutes\": 45,\n          \"resource\": [\n            {\n              \"title\": \"Convection Heat Transfer Textbook\",\n              \"type\": \"textbook\",\n              \"url\": null,\n              \"description\": \"Section 6.3\"\n            }\n          ],\n          \"is_completed\": false,\n          \"learning_objectives\": [\n            \"Understand the transition from laminar to turbulent flow.\",\n            \"Calculate and interpret Reynolds number.\"\n          ],\n          \"priority\": \"high\"\n        },\n        {\n          \"topic\": \"Flow Regime Effects\",\n          \"description\": \"Work through Example 6.4 on flow regime effects.\",\n          \"duration_minutes\": 30,\n          \"resource\": [\n            {\n              \"title\": \"Convection Heat Transfer Textbook\",\n              \"type\": \"textbook\",\n              \"url\": null,\n              \"description\": \"Example 6.4\"\n            }\n          ],\n          \"is_completed\": false,\n          \"learning_objectives\": [\n            \"Analyze the impact of flow regime on heat transfer.\",\n            \"Apply Reynolds number to practical problems.\"\n          ],\n          \"priority\": \"high\"\n        }\n      ],\n      \"summary\": \"Compared laminar and turbulent flow, analyzed transition criteria using Reynolds number, and examined the effects of flow regime on heat transfer.\",\n      \"learning_goals\": [\n        \"Understand flow regimes.\",\n        \"Analyze transition criteria.\"\n      ],\n      \"review_topics\": [\n        \"Convection Coefficients\"\n      ]\n    },\n    {\n      \"day\": 4,\n      \"date\": null,\n      \"focus_area\": \"Governing Equations\",\n      \"study_item\": [\n        {\n          \"topic\": \"Boundary Layer Equations\",\n          \"description\": \"Study simplified boundary layer equations (6.27-6.30).\",\n          \"duration_minutes\": 60,\n          \"resource\": [\n            {\n              \"title\": \"Convection Heat Transfer Textbook\",\n              \"type\": \"textbook\",\n              \"url\": null,\n              \"description\": \"Equations 6.27-6.30\"\n            }\n          ],\n          \"is_completed\": false,\n          \"learning_objectives\": [\n            \"Understand the simplified boundary layer equations.\",\n            \"Analyze their derivation and significance.\"\n          ],\n          \"priority\": \"high\"\n        },\n        {\n          \"topic\": \"Assumptions and Limitations\",\n          \"description\": \"Examine assumptions and limitations of boundary layer equations.\",\n          \"duration_minutes\": 30,\n          \"resource\": [\n            {\n              \"title\": \"Convection Heat Transfer Textbook\",\n              \"type\": \"textbook\",\n              \"url\": null,\n              \"description\": \"Section 6.4\"\n            }\n          ],\n          \"is_completed\": false,\n          \"learning_objectives\": [\n            \"Understand the assumptions behind boundary layer equations.\",\n            \"Recognize their limitations.\"\n          ],\n          \"priority\": \"high\"\n        },\n        {\n          \"topic\": \"Momentum/Energy Equations\",\n          \"description\": \"Solve problems involving momentum/energy equations.\",\n          \"duration_minutes\": 30,\n          \"resource\": [\n            {\n              \"title\": \"Convection Heat Transfer Textbook\",\n              \"type\": \"textbook\",\n              \"url\": null,\n              \"description\": \"Practice Problems\"\n            }\n          ],\n          \"is_completed\": false,\n          \"learning_objectives\": [\n            \"Apply boundary layer equations to solve problems.\",\n            \"Integrate momentum and energy equations.\"\n          ],\n          \"priority\": \"high\"\n        }\n      ],\n      \"summary\": \"Studied the simplified boundary layer equations, examined their assumptions and limitations, and solved problems involving momentum and energy equations.\",\n      \"learning_goals\": [\n        \"Understand boundary layer equations.\",\n        \"Apply momentum and energy equations.\"\n      ],\n      \"review_topics\": [\n        \"Flow Regimes\"\n      ]\n    },\n    {\n      \"day\": 5,\n      \"date\": null,\n      \"focus_area\": \"Dimensionless Analysis\",\n      \"study_item\": [\n        {\n          \"topic\": \"Similarity Parameters\",\n          \"description\": \"Learn similarity parameters (Re, Pr, Sc, Nu, Sh).\",\n          \"duration_minutes\": 45,\n          \"resource\": [\n            {\n              \"title\": \"Convection Heat Transfer Textbook\",\n              \"type\": \"textbook\",\n              \"url\": null,\n              \"description\": \"Section 6.5\"\n            }\n          ],\n          \"is_completed\": false,\n          \"learning_objectives\": [\n            \"Understand key dimensionless numbers.\",\n            \"Interpret their physical significance.\"\n          ],\n          \"priority\": \"high\"\n        },\n        {\n          \"topic\": \"Normalized Equations\",\n          \"description\": \"Study normalized equations (Table 6.1).\",\n          \"duration_minutes\": 45,\n          \"resource\": [\n            {\n              \"title\": \"Convection Heat Transfer Textbook\",\n              \"type\": \"textbook\",\n              \"url\": null,\n              \"description\": \"Table 6.1\"\n            }\n          ],\n          \"is_completed\": false,\n          \"learning_objectives\": [\n            \"Analyze normalized boundary layer equations.\",\n            \"Understand the role of dimensionless numbers.\"\n          ],\n          \"priority\": \"high\"\n        },\n        {\n          \"topic\": \"Dimensionless Groups\",\n          \"description\": \"Work through Example 6.5 on dimensionless groups.\",\n          \"duration_minutes\": 30,\n          \"resource\": [\n            {\n              \"title\": \"Convection Heat Transfer Textbook\",\n              \"type\": \"textbook\",\n              \"url\": null,\n              \"description\": \"Example 6.5\"\n            }\n          ],\n          \"is_completed\": false,\n          \"learning_objectives\": [\n            \"Apply dimensionless analysis to solve problems.\",\n            \"Interpret results in terms of dimensionless groups.\"\n          ],\n          \"priority\": \"high\"\n        }\n      ],\n      \"summary\": \"Learned about key dimensionless numbers, studied normalized boundary layer equations, and applied dimensionless analysis to solve problems.\",\n      \"learning_goals\": [\n        \"Understand dimensionless analysis.\",\n        \"Apply similarity parameters.\"\n      ],\n      \"review_topics\": [\n        \"Governing Equations\"\n      ]\n    },\n    {\n      \"day\": 6,\n      \"date\": null,\n      \"focus_area\": \"Analogies\",\n      \"study_item\": [\n        {\n          \"topic\": \"Heat-Mass Transfer Analogy\",\n          \"description\": \"Study heat-mass transfer analogy (Section 6.7.1).\",\n          \"duration_minutes\": 60,\n          \"resource\": [\n            {\n              \"title\": \"Convection Heat Transfer Textbook\",\n              \"type\": \"textbook\",\n              \"url\": null,\n              \"description\": \"Section 6.7.1\"\n            }\n          ],\n          \"is_completed\": false,\n          \"learning_objectives\": [\n            \"Understand the analogy between heat and mass transfer.\",\n            \"Analyze the governing equations.\"\n          ],\n          \"priority\": \"high\"\n        },\n        {\n          \"topic\": \"Reynolds Analogy\",\n          \"description\": \"Analyze Reynolds analogy (Equations 6.66-6.69).\",\n          \"duration_minutes\": 30,\n          \"resource\": [\n            {\n              \"title\": \"Convection Heat Transfer Textbook\",\n              \"type\": \"textbook\",\n              \"url\": null,\n              \"description\": \"Equations 6.66-6.69\"\n            }\n          ],\n          \"is_completed\": false,\n          \"learning_objectives\": [\n            \"Understand the Reynolds analogy.\",\n            \"Apply it to solve problems.\"\n          ],\n          \"priority\": \"high\"\n        },\n        {\n          \"topic\": \"Practical Applications\",\n          \"description\": \"Solve Example 6.7 on practical applications.\",\n          \"duration_minutes\": 30,\n          \"resource\": [\n            {\n              \"title\": \"Convection Heat Transfer Textbook\",\n              \"type\": \"textbook\",\n              \"url\": null,\n              \"description\": \"Example 6.7\"\n            }\n          ],\n          \"is_completed\": false,\n          \"learning_objectives\": [\n            \"Apply analogies to practical problems.\",\n            \"Integrate heat and mass"
  }
}