{
  "raw_response": "CORE:\n```json\n{\n  \"overall_goal\": \"Master the fundamental concepts of convection heat transfer and boundary layer theory, focusing on boundary layer development, convection coefficients, flow regimes, boundary layer equations, and dimensionless parameters.\",\n  \"total_study_day\": \"7\",\n  \"hour_per_day\": \"2.0\",\n  \"core_concepts\": [\n    {\n      \"name\": \"Boundary Layer Concepts\",\n      \"explanation\": \"The region near a surface where fluid velocity, temperature, or concentration changes from the free-stream value to the surface value.\",\n      \"importance\": \"Fundamental to understanding convective heat and mass transfer processes.\",\n      \"related_concepts\": [\n        \"Velocity Boundary Layer\",\n        \"Thermal Boundary Layer\"\n      ],\n      \"examples\": [\n        \"Air flow over a flat plate\",\n        \"Water flow in a pipe\"\n      ],\n      \"difficulty_level\": \"basic\"\n    },\n    {\n      \"name\": \"Convection Coefficients\",\n      \"explanation\": \"Parameters that quantify the rate of heat or mass transfer between a surface and a fluid.\",\n      \"importance\": \"Essential for calculating heat and mass transfer rates in engineering applications.\",\n      \"related_concepts\": [\n        \"Local Coefficients\",\n        \"Average Coefficients\"\n      ],\n      \"examples\": [\n        \"Heat transfer from a heated plate\",\n        \"Mass transfer in a drying process\"\n      ],\n      \"difficulty_level\": \"intermediate\"\n    },\n    {\n      \"name\": \"Flow Regimes\",\n      \"explanation\": \"Different patterns of fluid flow characterized as laminar or turbulent.\",\n      \"importance\": \"Determines the nature of heat and mass transfer and affects the boundary layer development.\",\n      \"related_concepts\": [\n        \"Laminar Flow\",\n        \"Turbulent Flow\"\n      ],\n      \"examples\": [\n        \"Smooth flow in a pipe (laminar)\",\n        \"Chaotic flow in a river (turbulent)\"\n      ],\n      \"difficulty_level\": \"basic\"\n    },\n    {\n      \"name\": \"Boundary Layer Equations\",\n      \"explanation\": \"Mathematical formulations describing the conservation of mass, momentum, and energy in boundary layers.\",\n      \"importance\": \"Provides the theoretical foundation for analyzing and solving convection problems.\",\n      \"related_concepts\": [\n        \"Continuity Equation\",\n        \"Momentum Equation\"\n      ],\n      \"examples\": [\n        \"Navier-Stokes equations for boundary layers\",\n        \"Energy equation for thermal boundary layers\"\n      ],\n      \"difficulty_level\": \"intermediate\"\n    },\n    {\n      \"name\": \"Dimensionless Parameters\",\n      \"explanation\": \"Non-dimensional numbers that characterize the relative importance of different physical effects in convection.\",\n      \"importance\": \"Simplifies analysis and allows for scaling of results to different systems.\",\n      \"related_concepts\": [\n        \"Reynolds Number (Re)\",\n        \"Prandtl Number (Pr)\"\n      ],\n      \"examples\": [\n        \"Reynolds number for flow characterization\",\n        \"Nusselt number for heat transfer\"\n      ],\n      \"difficulty_level\": \"intermediate\"\n    }\n  ],\n  \"general_tip\": [\n    \"Create concept maps to visualize relationships between parameters.\",\n    \"Focus on physical interpretations of dimensionless numbers.\",\n    \"Work through all chapter examples with pencil and paper.\",\n    \"Use color-coding for different boundary layers in diagrams.\",\n    \"Practice deriving key equations from fundamental principles.\"\n  ]\n}\n```\n\nSCHEDULE:\n```json\n{\n  \"overall_goal\": \"Master the fundamental concepts of convection heat transfer and boundary layer theory, focusing on velocity, thermal, and concentration boundary layers, convection coefficients, and flow regimes.\",\n  \"total_study_day\": \"7\",\n  \"hour_per_day\": \"2.0\",\n  \"core_concept\": [\n    {\n      \"name\": \"Boundary Layer Concepts\",\n      \"explanation\": \"The boundary layer is the region near a surface where the velocity, temperature, or concentration changes from the free stream value to the surface value.\",\n      \"importance\": \"Understanding boundary layers is crucial for analyzing heat and mass transfer in fluid flows.\",\n      \"related_concept\": [\n        \"Velocity Boundary Layer\",\n        \"Thermal Boundary Layer\"\n      ],\n      \"example\": [\n        \"Velocity boundary layer over a flat plate\",\n        \"Thermal boundary layer in a heated pipe\"\n      ],\n      \"difficulty_level\": \"basic\"\n    }\n  ],\n  \"daily_schedule\": [\n    {\n      \"day\": 1,\n      \"focus_area\": \"Introduction to Boundary Layers\",\n      \"study_item\": [\n        {\n          \"topic\": \"Boundary Layer Concepts\",\n          \"description\": \"Read and summarize section 6.1 on boundary layer concepts.\",\n          \"duration_minutes\": 30,\n          \"resource\": [\n            {\n              \"title\": \"Textbook Chapter 6\",\n              \"type\": \"textbook\",\n              \"url\": null,\n              \"description\": \"Introduction to boundary layers and their significance.\"\n            }\n          ],\n          \"is_completed\": false,\n          \"learning_objective\": [\n            \"Understand the concept of boundary layers\",\n            \"Differentiate between velocity and thermal boundary layers\"\n          ],\n          \"priority\": \"high\"\n        },\n        {\n          \"topic\": \"Velocity Boundary Layer Development\",\n          \"description\": \"Study velocity boundary layer development from figures 6.1-6.3.\",\n          \"duration_minutes\": 30,\n          \"resource\": [\n            {\n              \"title\": \"Textbook Figures 6.1-6.3\",\n              \"type\": \"diagram\",\n              \"url\": null,\n              \"description\": \"Illustrations of velocity boundary layer development.\"\n            }\n          ],\n          \"is_completed\": false,\n          \"learning_objective\": [\n            \"Visualize boundary layer growth\",\n            \"Understand the transition from laminar to turbulent flow\"\n          ],\n          \"priority\": \"high\"\n        },\n        {\n          \"topic\": \"Local vs. Average Coefficients\",\n          \"description\": \"Work through example 6.1 on local vs. average coefficients.\",\n          \"duration_minutes\": 30,\n          \"resource\": [\n            {\n              \"title\": \"Example 6.1\",\n              \"type\": \"example\",\n              \"url\": null,\n              \"description\": \"Demonstration of local and average convection coefficients.\"\n            }\n          ],\n          \"is_completed\": false,\n          \"learning_objective\": [\n            \"Calculate local and average coefficients\",\n            \"Apply boundary layer concepts to solve problems\"\n          ],\n          \"priority\": \"high\"\n        }\n      ],\n      \"summary\": \"Introduced boundary layer concepts and studied velocity boundary layer development, including local vs. average coefficients.\",\n      \"learning_goal\": [\n        \"Understand the fundamental concept of boundary layers\",\n        \"Differentiate between local and average coefficients\"\n      ],\n      \"review_topic\": [\n        \"Boundary layer thickness calculations\"\n      ]\n    },\n    {\n      \"day\": 2,\n      \"focus_area\": \"Convection Coefficients\",\n      \"study_item\": [\n        {\n          \"topic\": \"Local and Average Coefficients\",\n          \"description\": \"Study section 6.2 on local and average convection coefficients.\",\n          \"duration_minutes\": 45,\n          \"resource\": [\n            {\n              \"title\": \"Textbook Section 6.2\",\n              \"type\": \"textbook\",\n              \"url\": null,\n              \"description\": \"Detailed explanation of local and average coefficients.\"\n            }\n          ],\n          \"is_completed\": false,\n          \"learning_objective\": [\n            \"Understand the difference between local and average coefficients\",\n            \"Apply coefficients to mass transfer applications\"\n          ],\n          \"priority\": \"high\"\n        },\n        {\n          \"topic\": \"Mass Transfer Applications\",\n          \"description\": \"Work through examples 6.2 and 6.3 on mass transfer applications.\",\n          \"duration_minutes\": 45,\n          \"resource\": [\n            {\n              \"title\": \"Examples 6.2 and\n\nFORMULAS:\n```json\n{\n  \"key_formulas\": [\n    {\n      \"name\": \"Reynolds Number\",\n      \"formula\": \"Re = (\u03c1 * u * L) / \u03bc\",\n      \"description\": \"Dimensionless number that predicts flow patterns in different fluid flow situations\",\n      \"usage_context\": \"Used to determine whether flow is laminar or turbulent in boundary layer analysis\"\n    },\n    {\n      \"name\": \"Prandtl Number\",\n      \"formula\": \"Pr = (\u03bc * cp) / k\",\n      \"description\": \"Ratio of momentum diffusivity to thermal diffusivity\",\n      \"usage_context\": \"Used in heat transfer problems to relate velocity boundary layer to thermal boundary layer\"\n    },\n    {\n      \"name\": \"Nusselt Number\",\n      \"formula\": \"Nu = (h * L) / k\",\n      \"description\": \"Ratio of convective to conductive heat transfer\",\n      \"usage_context\": \"Used to calculate convection heat transfer coefficients in boundary layer problems\"\n    },\n    {\n      \"name\": \"Schmidt Number\",\n      \"description\": \"Ratio of momentum diffusivity to mass diffusivity\",\n      \"formula\": \"Sc = \u03bc / (\u03c1 * DAB)\",\n      \"usage_context\": \"Used in mass transfer problems to relate velocity boundary layer to concentration boundary layer\"\n    },\n    {\n      \"name\": \"Sherwood Number\",\n      \"formula\": \"Sh = (hm * L) / DAB\",\n      \"description\": \"Ratio of convective to diffusive mass transfer\",\n      \"usage_context\": \"Used to calculate mass transfer coefficients in boundary layer problems\"\n    },\n    {\n      \"name\": \"Boundary Layer Thickness\",\n      \"formula\": \"\u03b4 \u2248 5.0 * x / sqrt(Rex)\",\n      \"description\": \"Approximate thickness of the velocity boundary layer\",\n      \"usage_context\": \"Used to estimate boundary layer growth along a flat plate in laminar flow\"\n    },\n    {\n      \"name\": \"Local Heat Transfer Coefficient\",\n      \"formula\": \"hx = (k / x) * 0.332 * Rex^(1/2) * Pr^(1/3)\",\n      \"description\": \"Local convection coefficient for laminar flow over a flat plate\",\n      \"usage_context\": \"Used to calculate heat transfer at specific locations along a surface\"\n    }\n  ]\n}\n```",
  "error": {
    "error": "Failed to validate structured plan",
    "details": "10 validation errors for StructuredStudyPlan\ndaily_schedule.0.day\n  Field required [type=missing, input_value={'name': 'Boundary Layer ...ficulty_level': 'basic'}, input_type=dict]\n    For further information visit https://errors.pydantic.dev/2.11/v/missing\ndaily_schedule.0.focus_area\n  Field required [type=missing, input_value={'name': 'Boundary Layer ...ficulty_level': 'basic'}, input_type=dict]\n    For further information visit https://errors.pydantic.dev/2.11/v/missing\ndaily_schedule.0.study_item\n  Field required [type=missing, input_value={'name': 'Boundary Layer ...ficulty_level': 'basic'}, input_type=dict]\n    For further information visit https://errors.pydantic.dev/2.11/v/missing\ndaily_schedule.0.summary\n  Field required [type=missing, input_value={'name': 'Boundary Layer ...ficulty_level': 'basic'}, input_type=dict]\n    For further information visit https://errors.pydantic.dev/2.11/v/missing\ndaily_schedule.1.study_item\n  Field required [type=missing, input_value={'name': 'Boundary Layer ...Additional study day 2'}, input_type=dict]\n    For further information visit https://errors.pydantic.dev/2.11/v/missing\ndaily_schedule.2.study_item\n  Field required [type=missing, input_value={'name': 'Boundary Layer ...Additional study day 3'}, input_type=dict]\n    For further information visit https://errors.pydantic.dev/2.11/v/missing\ndaily_schedule.3.study_item\n  Field required [type=missing, input_value={'name': 'Boundary Layer ...Additional study day 4'}, input_type=dict]\n    For further information visit https://errors.pydantic.dev/2.11/v/missing\ndaily_schedule.4.study_item\n  Field required [type=missing, input_value={'name': 'Boundary Layer ...Additional study day 5'}, input_type=dict]\n    For further information visit https://errors.pydantic.dev/2.11/v/missing\ndaily_schedule.5.study_item\n  Field required [type=missing, input_value={'name': 'Boundary Layer ...Additional study day 6'}, input_type=dict]\n    For further information visit https://errors.pydantic.dev/2.11/v/missing\ndaily_schedule.6.study_item\n  Field required [type=missing, input_value={'name': 'Boundary Layer ...Additional study day 7'}, input_type=dict]\n    For further information visit https://errors.pydantic.dev/2.11/v/missing",
    "parsed_json": {
      "overall_goal": "Master the fundamental concepts of convection heat transfer and boundary layer theory, focusing on boundary layer development, convection coefficients, flow regimes, boundary layer equations, and dimensionless parameters.",
      "total_study_day": 7,
      "hour_per_day": 2.0,
      "core_concepts": [
        {
          "name": "Boundary Layer Concepts",
          "explanation": "The region near a surface where fluid velocity, temperature, or concentration changes from the free-stream value to the surface value.",
          "importance": "Fundamental to understanding convective heat and mass transfer processes.",
          "related_concepts": [
            "Velocity Boundary Layer",
            "Thermal Boundary Layer"
          ],
          "examples": [
            "Air flow over a flat plate",
            "Water flow in a pipe"
          ],
          "difficulty_level": "basic"
        },
        {
          "name": "Convection Coefficients",
          "explanation": "Parameters that quantify the rate of heat or mass transfer between a surface and a fluid.",
          "importance": "Essential for calculating heat and mass transfer rates in engineering applications.",
          "related_concepts": [
            "Local Coefficients",
            "Average Coefficients"
          ],
          "examples": [
            "Heat transfer from a heated plate",
            "Mass transfer in a drying process"
          ],
          "difficulty_level": "intermediate"
        },
        {
          "name": "Flow Regimes",
          "explanation": "Different patterns of fluid flow characterized as laminar or turbulent.",
          "importance": "Determines the nature of heat and mass transfer and affects the boundary layer development.",
          "related_concepts": [
            "Laminar Flow",
            "Turbulent Flow"
          ],
          "examples": [
            "Smooth flow in a pipe (laminar)",
            "Chaotic flow in a river (turbulent)"
          ],
          "difficulty_level": "basic"
        },
        {
          "name": "Boundary Layer Equations",
          "explanation": "Mathematical formulations describing the conservation of mass, momentum, and energy in boundary layers.",
          "importance": "Provides the theoretical foundation for analyzing and solving convection problems.",
          "related_concepts": [
            "Continuity Equation",
            "Momentum Equation"
          ],
          "examples": [
            "Navier-Stokes equations for boundary layers",
            "Energy equation for thermal boundary layers"
          ],
          "difficulty_level": "intermediate"
        },
        {
          "name": "Dimensionless Parameters",
          "explanation": "Non-dimensional numbers that characterize the relative importance of different physical effects in convection.",
          "importance": "Simplifies analysis and allows for scaling of results to different systems.",
          "related_concepts": [
            "Reynolds Number (Re)",
            "Prandtl Number (Pr)"
          ],
          "examples": [
            "Reynolds number for flow characterization",
            "Nusselt number for heat transfer"
          ],
          "difficulty_level": "intermediate"
        }
      ],
      "general_tip": [
        "Create concept maps to visualize relationships between parameters.",
        "Focus on physical interpretations of dimensionless numbers.",
        "Work through all chapter examples with pencil and paper.",
        "Use color-coding for different boundary layers in diagrams.",
        "Practice deriving key equations from fundamental principles."
      ],
      "daily_schedule": [
        {
          "name": "Boundary Layer Concepts",
          "explanation": "The boundary layer is the region near a surface where the velocity, temperature, or concentration changes from the free stream value to the surface value.",
          "importance": "Understanding boundary layers is crucial for analyzing heat and mass transfer in fluid flows.",
          "related_concept": [
            "Velocity Boundary Layer",
            "Thermal Boundary Layer"
          ],
          "example": [
            "Velocity boundary layer over a flat plate",
            "Thermal boundary layer in a heated pipe"
          ],
          "difficulty_level": "basic"
        },
        {
          "name": "Boundary Layer Concepts",
          "explanation": "The boundary layer is the region near a surface where the velocity, temperature, or concentration changes from the free stream value to the surface value.",
          "importance": "Understanding boundary layers is crucial for analyzing heat and mass transfer in fluid flows.",
          "related_concept": [
            "Velocity Boundary Layer",
            "Thermal Boundary Layer"
          ],
          "example": [
            "Velocity boundary layer over a flat plate",
            "Thermal boundary layer in a heated pipe"
          ],
          "difficulty_level": "basic",
          "day": 2,
          "focus_area": "Additional study for day 2",
          "summary": "Additional study day 2"
        },
        {
          "name": "Boundary Layer Concepts",
          "explanation": "The boundary layer is the region near a surface where the velocity, temperature, or concentration changes from the free stream value to the surface value.",
          "importance": "Understanding boundary layers is crucial for analyzing heat and mass transfer in fluid flows.",
          "related_concept": [
            "Velocity Boundary Layer",
            "Thermal Boundary Layer"
          ],
          "example": [
            "Velocity boundary layer over a flat plate",
            "Thermal boundary layer in a heated pipe"
          ],
          "difficulty_level": "basic",
          "day": 3,
          "focus_area": "Additional study for day 3",
          "summary": "Additional study day 3"
        },
        {
          "name": "Boundary Layer Concepts",
          "explanation": "The boundary layer is the region near a surface where the velocity, temperature, or concentration changes from the free stream value to the surface value.",
          "importance": "Understanding boundary layers is crucial for analyzing heat and mass transfer in fluid flows.",
          "related_concept": [
            "Velocity Boundary Layer",
            "Thermal Boundary Layer"
          ],
          "example": [
            "Velocity boundary layer over a flat plate",
            "Thermal boundary layer in a heated pipe"
          ],
          "difficulty_level": "basic",
          "day": 4,
          "focus_area": "Additional study for day 4",
          "summary": "Additional study day 4"
        },
        {
          "name": "Boundary Layer Concepts",
          "explanation": "The boundary layer is the region near a surface where the velocity, temperature, or concentration changes from the free stream value to the surface value.",
          "importance": "Understanding boundary layers is crucial for analyzing heat and mass transfer in fluid flows.",
          "related_concept": [
            "Velocity Boundary Layer",
            "Thermal Boundary Layer"
          ],
          "example": [
            "Velocity boundary layer over a flat plate",
            "Thermal boundary layer in a heated pipe"
          ],
          "difficulty_level": "basic",
          "day": 5,
          "focus_area": "Additional study for day 5",
          "summary": "Additional study day 5"
        },
        {
          "name": "Boundary Layer Concepts",
          "explanation": "The boundary layer is the region near a surface where the velocity, temperature, or concentration changes from the free stream value to the surface value.",
          "importance": "Understanding boundary layers is crucial for analyzing heat and mass transfer in fluid flows.",
          "related_concept": [
            "Velocity Boundary Layer",
            "Thermal Boundary Layer"
          ],
          "example": [
            "Velocity boundary layer over a flat plate",
            "Thermal boundary layer in a heated pipe"
          ],
          "difficulty_level": "basic",
          "day": 6,
          "focus_area": "Additional study for day 6",
          "summary": "Additional study day 6"
        },
        {
          "name": "Boundary Layer Concepts",
          "explanation": "The boundary layer is the region near a surface where the velocity, temperature, or concentration changes from the free stream value to the surface value.",
          "importance": "Understanding boundary layers is crucial for analyzing heat and mass transfer in fluid flows.",
          "related_concept": [
            "Velocity Boundary Layer",
            "Thermal Boundary Layer"
          ],
          "example": [
            "Velocity boundary layer over a flat plate",
            "Thermal boundary layer in a heated pipe"
          ],
          "difficulty_level": "basic",
          "day": 7,
          "focus_area": "Additional study for day 7",
          "summary": "Additional study day 7"
        }
      ],
      "key_formulas": [
        {
          "name": "Reynolds Number",
          "formula": "Re = (\u03c1 * u * L) / \u03bc",
          "description": "Dimensionless number that predicts flow patterns in different fluid flow situations",
          "usage_context": "Used to determine whether flow is laminar or turbulent in boundary layer analysis"
        },
        {
          "name": "Prandtl Number",
          "formula": "Pr = (\u03bc * cp) / k",
          "description": "Ratio of momentum diffusivity to thermal diffusivity",
          "usage_context": "Used in heat transfer problems to relate velocity boundary layer to thermal boundary layer"
        },
        {
          "name": "Nusselt Number",
          "formula": "Nu = (h * L) / k",
          "description": "Ratio of convective to conductive heat transfer",
          "usage_context": "Used to calculate convection heat transfer coefficients in boundary layer problems"
        },
        {
          "name": "Schmidt Number",
          "description": "Ratio of momentum diffusivity to mass diffusivity",
          "formula": "Sc = \u03bc / (\u03c1 * DAB)",
          "usage_context": "Used in mass transfer problems to relate velocity boundary layer to concentration boundary layer"
        },
        {
          "name": "Sherwood Number",
          "formula": "Sh = (hm * L) / DAB",
          "description": "Ratio of convective to diffusive mass transfer",
          "usage_context": "Used to calculate mass transfer coefficients in boundary layer problems"
        },
        {
          "name": "Boundary Layer Thickness",
          "formula": "\u03b4 \u2248 5.0 * x / sqrt(Rex)",
          "description": "Approximate thickness of the velocity boundary layer",
          "usage_context": "Used to estimate boundary layer growth along a flat plate in laminar flow"
        },
        {
          "name": "Local Heat Transfer Coefficient",
          "formula": "hx = (k / x) * 0.332 * Rex^(1/2) * Pr^(1/3)",
          "description": "Local convection coefficient for laminar flow over a flat plate",
          "usage_context": "Used to calculate heat transfer at specific locations along a surface"
        }
      ]
    },
    "raw_response": "CORE:\n```json\n{\n  \"overall_goal\": \"Master the fundamental concepts of convection heat transfer and boundary layer theory, focusing on boundary layer development, convection coefficients, flow regimes, boundary layer equations, and dimensionless parameters.\",\n  \"total_study_day\": \"7\",\n  \"hour_per_day\": \"2.0\",\n  \"core_concepts\": [\n    {\n      \"name\": \"Boundary Layer Concepts\",\n      \"explanation\": \"The region near a surface where fluid velocity, temperature, or concentration changes from the free-stream value to the surface value.\",\n      \"importance\": \"Fundamental to understanding convective heat and mass transfer processes.\",\n      \"related_concepts\": [\n        \"Velocity Boundary Layer\",\n        \"Thermal Boundary Layer\"\n      ],\n      \"examples\": [\n        \"Air flow over a flat plate\",\n        \"Water flow in a pipe\"\n      ],\n      \"difficulty_level\": \"basic\"\n    },\n    {\n      \"name\": \"Convection Coefficients\",\n      \"explanation\": \"Parameters that quantify the rate of heat or mass transfer between a surface and a fluid.\",\n      \"importance\": \"Essential for calculating heat and mass transfer rates in engineering applications.\",\n      \"related_concepts\": [\n        \"Local Coefficients\",\n        \"Average Coefficients\"\n      ],\n      \"examples\": [\n        \"Heat transfer from a heated plate\",\n        \"Mass transfer in a drying process\"\n      ],\n      \"difficulty_level\": \"intermediate\"\n    },\n    {\n      \"name\": \"Flow Regimes\",\n      \"explanation\": \"Different patterns of fluid flow characterized as laminar or turbulent.\",\n      \"importance\": \"Determines the nature of heat and mass transfer and affects the boundary layer development.\",\n      \"related_concepts\": [\n        \"Laminar Flow\",\n        \"Turbulent Flow\"\n      ],\n      \"examples\": [\n        \"Smooth flow in a pipe (laminar)\",\n        \"Chaotic flow in a river (turbulent)\"\n      ],\n      \"difficulty_level\": \"basic\"\n    },\n    {\n      \"name\": \"Boundary Layer Equations\",\n      \"explanation\": \"Mathematical formulations describing the conservation of mass, momentum, and energy in boundary layers.\",\n      \"importance\": \"Provides the theoretical foundation for analyzing and solving convection problems.\",\n      \"related_concepts\": [\n        \"Continuity Equation\",\n        \"Momentum Equation\"\n      ],\n      \"examples\": [\n        \"Navier-Stokes equations for boundary layers\",\n        \"Energy equation for thermal boundary layers\"\n      ],\n      \"difficulty_level\": \"intermediate\"\n    },\n    {\n      \"name\": \"Dimensionless Parameters\",\n      \"explanation\": \"Non-dimensional numbers that characterize the relative importance of different physical effects in convection.\",\n      \"importance\": \"Simplifies analysis and allows for scaling of results to different systems.\",\n      \"related_concepts\": [\n        \"Reynolds Number (Re)\",\n        \"Prandtl Number (Pr)\"\n      ],\n      \"examples\": [\n        \"Reynolds number for flow characterization\",\n        \"Nusselt number for heat transfer\"\n      ],\n      \"difficulty_level\": \"intermediate\"\n    }\n  ],\n  \"general_tip\": [\n    \"Create concept maps to visualize relationships between parameters.\",\n    \"Focus on physical interpretations of dimensionless numbers.\",\n    \"Work through all chapter examples with pencil and paper.\",\n    \"Use color-coding for different boundary layers in diagrams.\",\n    \"Practice deriving key equations from fundamental principles.\"\n  ]\n}\n```\n\nSCHEDULE:\n```json\n{\n  \"overall_goal\": \"Master the fundamental concepts of convection heat transfer and boundary layer theory, focusing on velocity, thermal, and concentration boundary layers, convection coefficients, and flow regimes.\",\n  \"total_study_day\": \"7\",\n  \"hour_per_day\": \"2.0\",\n  \"core_concept\": [\n    {\n      \"name\": \"Boundary Layer Concepts\",\n      \"explanation\": \"The boundary layer is the region near a surface where the velocity, temperature, or concentration changes from the free stream value to the surface value.\",\n      \"importance\": \"Understanding boundary layers is crucial for analyzing heat and mass transfer in fluid flows.\",\n      \"related_concept\": [\n        \"Velocity Boundary Layer\",\n        \"Thermal Boundary Layer\"\n      ],\n      \"example\": [\n        \"Velocity boundary layer over a flat plate\",\n        \"Thermal boundary layer in a heated pipe\"\n      ],\n      \"difficulty_level\": \"basic\"\n    }\n  ],\n  \"daily_schedule\": [\n    {\n      \"day\": 1,\n      \"focus_area\": \"Introduction to Boundary Layers\",\n      \"study_item\": [\n        {\n          \"topic\": \"Boundary Layer Concepts\",\n          \"description\": \"Read and summarize section 6.1 on boundary layer concepts.\",\n          \"duration_minutes\": 30,\n          \"resource\": [\n            {\n              \"title\": \"Textbook Chapter 6\",\n              \"type\": \"textbook\",\n              \"url\": null,\n              \"description\": \"Introduction to boundary layers and their significance.\"\n            }\n          ],\n          \"is_completed\": false,\n          \"learning_objective\": [\n            \"Understand the concept of boundary layers\",\n            \"Differentiate between velocity and thermal boundary layers\"\n          ],\n          \"priority\": \"high\"\n        },\n        {\n          \"topic\": \"Velocity Boundary Layer Development\",\n          \"description\": \"Study velocity boundary layer development from figures 6.1-6.3.\",\n          \"duration_minutes\": 30,\n          \"resource\": [\n            {\n              \"title\": \"Textbook Figures 6.1-6.3\",\n              \"type\": \"diagram\",\n              \"url\": null,\n              \"description\": \"Illustrations of velocity boundary layer development.\"\n            }\n          ],\n          \"is_completed\": false,\n          \"learning_objective\": [\n            \"Visualize boundary layer growth\",\n            \"Understand the transition from laminar to turbulent flow\"\n          ],\n          \"priority\": \"high\"\n        },\n        {\n          \"topic\": \"Local vs. Average Coefficients\",\n          \"description\": \"Work through example 6.1 on local vs. average coefficients.\",\n          \"duration_minutes\": 30,\n          \"resource\": [\n            {\n              \"title\": \"Example 6.1\",\n              \"type\": \"example\",\n              \"url\": null,\n              \"description\": \"Demonstration of local and average convection coefficients.\"\n            }\n          ],\n          \"is_completed\": false,\n          \"learning_objective\": [\n            \"Calculate local and average coefficients\",\n            \"Apply boundary layer concepts to solve problems\"\n          ],\n          \"priority\": \"high\"\n        }\n      ],\n      \"summary\": \"Introduced boundary layer concepts and studied velocity boundary layer development, including local vs. average coefficients.\",\n      \"learning_goal\": [\n        \"Understand the fundamental concept of boundary layers\",\n        \"Differentiate between local and average coefficients\"\n      ],\n      \"review_topic\": [\n        \"Boundary layer thickness calculations\"\n      ]\n    },\n    {\n      \"day\": 2,\n      \"focus_area\": \"Convection Coefficients\",\n      \"study_item\": [\n        {\n          \"topic\": \"Local and Average Coefficients\",\n          \"description\": \"Study section 6.2 on local and average convection coefficients.\",\n          \"duration_minutes\": 45,\n          \"resource\": [\n            {\n              \"title\": \"Textbook Section 6.2\",\n              \"type\": \"textbook\",\n              \"url\": null,\n              \"description\": \"Detailed explanation of local and average coefficients.\"\n            }\n          ],\n          \"is_completed\": false,\n          \"learning_objective\": [\n            \"Understand the difference between local and average coefficients\",\n            \"Apply coefficients to mass transfer applications\"\n          ],\n          \"priority\": \"high\"\n        },\n        {\n          \"topic\": \"Mass Transfer Applications\",\n          \"description\": \"Work through examples 6.2 and 6.3 on mass transfer applications.\",\n          \"duration_minutes\": 45,\n          \"resource\": [\n            {\n              \"title\": \"Examples 6.2 and\n\nFORMULAS:\n```json\n{\n  \"key_formulas\": [\n    {\n      \"name\": \"Reynolds Number\",\n      \"formula\": \"Re = (\u03c1 * u * L) / \u03bc\",\n      \"description\": \"Dimensionless number that predicts flow patterns in different fluid flow situations\",\n      \"usage_context\": \"Used to determine whether flow is laminar or turbulent in boundary layer analysis\"\n    },\n    {\n      \"name\": \"Prandtl Number\",\n      \"formula\": \"Pr = (\u03bc * cp) / k\",\n      \"description\": \"Ratio of momentum diffusivity to thermal diffusivity\",\n      \"usage_context\": \"Used in heat transfer problems to relate velocity boundary layer to thermal boundary layer\"\n    },\n    {\n      \"name\": \"Nusselt Number\",\n      \"formula\": \"Nu = (h * L) / k\",\n      \"description\": \"Ratio of convective to conductive heat transfer\",\n      \"usage_context\": \"Used to calculate convection heat transfer coefficients in boundary layer problems\"\n    },\n    {\n      \"name\": \"Schmidt Number\",\n      \"description\": \"Ratio of momentum diffusivity to mass diffusivity\",\n      \"formula\": \"Sc = \u03bc / (\u03c1 * DAB)\",\n      \"usage_context\": \"Used in mass transfer problems to relate velocity boundary layer to concentration boundary layer\"\n    },\n    {\n      \"name\": \"Sherwood Number\",\n      \"formula\": \"Sh = (hm * L) / DAB\",\n      \"description\": \"Ratio of convective to diffusive mass transfer\",\n      \"usage_context\": \"Used to calculate mass transfer coefficients in boundary layer problems\"\n    },\n    {\n      \"name\": \"Boundary Layer Thickness\",\n      \"formula\": \"\u03b4 \u2248 5.0 * x / sqrt(Rex)\",\n      \"description\": \"Approximate thickness of the velocity boundary layer\",\n      \"usage_context\": \"Used to estimate boundary layer growth along a flat plate in laminar flow\"\n    },\n    {\n      \"name\": \"Local Heat Transfer Coefficient\",\n      \"formula\": \"hx = (k / x) * 0.332 * Rex^(1/2) * Pr^(1/3)\",\n      \"description\": \"Local convection coefficient for laminar flow over a flat plate\",\n      \"usage_context\": \"Used to calculate heat transfer at specific locations along a surface\"\n    }\n  ]\n}\n```"
  }
}